Submission Title,Submission Author,Subreddit,Number of Comments,Time Filter
Megathread: House Votes to Impeach President Donald J. Trump,PoliticsModeratorBot,Politics,52218,all
Virginia governor makes Election Day a holiday and expands early voting,nclobo,Politics,4158,all
"Video emerges showing Trump talking about cutting pandemic team in 2018, despite saying last week 'I didn't know about it'",Nihilist911,Politics,4785,all
"The Trump administration paid a bankrupt company with zero employees $55 million for N95 masks, which it's never manufactured",DaFunkJunkie,Politics,4809,all
Removed US coronavirus vaccine director files stunning whistleblower complaint claiming warnings were ignored,grepnork,Politics,5089,all
"Kim Davis, clerk who refused to sign marriage licenses for gay couples, loses to Democrat",FuegoFerdinand,Politics,2757,all
"Chuck Schumer made sure businesses controlled by Trump, his family, and top US officials couldn't get money from the government's $2 trillion coronavirus bailout fund",DaFunkJunkie,Politics,5089,all
"Bernie Sanders Becomes First Candidate, Democrat or Republican, to Win Popular Vote in All 3 Three Early Voting States",NewserUser,Politics,4970,all
Trump revealed highly classified information to Russian foreign minister and ambassador.,SQUEEEEEEEEEPS,Politics,20791,all
"They. Sold. Their. Stock. They could have made a difference, but they made a profit.",jigsawmap,Politics,3921,all
The FBI Just Put White Nationalists and Neo-Nazis on the Same Threat Level as ISIS,N0tAG00dUserName,Politics,5226,all
"Opinion: If you’re ‘essential’ enough to work through a pandemic, you’re essential enough to be paid a living wage",LosIsosceles,Politics,4690,all
Trump suggests injecting disinfectant to treat coronavirus and touts power of sunlight to beat disease,grepnork,Politics,12701,all
"Trump Ordered Mueller Fired, but Backed Off When White House Counsel Threatened to Quit",71tsiser,Politics,14482,all
Virginia will eliminate a state holiday honoring Robert E. Lee and Stonewall Jackson. It'll make Election Day a day off instead,nnnarbz,Politics,5306,all
Jon Stewart Goes Off On Congress During 9/11 Hearing,holyfruits,Politics,6489,all
Donald Trump Called To Resign After Sleeping During Coronavirus Meeting: COVID19 Response A Failure,iggy555,Politics,6402,all
Clinton: 'Please do not take medical advice from a man who looked directly at a solar eclipse',Lixard52,Politics,3513,all
California bans private prisons – including Ice detention centers,segvcore,Politics,3260,all
Washington state radio station won't air Trump briefings because of 'false or misleading information',TheGamerDanYT,Politics,3977,all
Anthony Fauci calls out “extraordinary stigma” gays face while standing right in front of Mike Pence,Cyke101,Politics,3885,all
Ivanka Trump used a personal email account to send hundreds of emails about government business last year,Bloodbath-McGrath,Politics,6456,all
Sanders: 'I never expected in my life as an American to see a swastika at a major political rally',Thinkingonsleeping,Politics,6253,all
"Fed should pay every American more, let hedge funds and billionaires ‘get wiped out,’ says Social Capital CEO | ‘What we’ve done is disproportionately prop up poor-performing CEOs and boards,’ Chamath Palihapitiya tells CNBC",viva_la_vinyl,Politics,4320,all
GOP Lawmaker Who Voted Against Paid Sick Leave in Florida Takes Paid Leave From Congress,koavf,Politics,3182,all
Alexandria Ocasio-Cortez To Co-Sponsor House Bill Banning Members Of Congress From Trading Stocks,roku44,Politics,2302,all
A petition calling for FCC Chairman Ajit Pai to resign is racking up huge numbers,mixplate,Politics,1936,all
F.B.I. Opened Inquiry Into Whether Trump Was Secretly Working on Behalf of Russia,Eurynom0s,Politics,7911,all
The FCC’s craven net neutrality vote announcement makes no mention of the 22 million comments filed,wonderingsocrates,Politics,1716,all
Poll: 57% of voters say US political system works only for insiders with money & power,grepnork,Politics,3255,all
McConnell blocks House bill to reopen government for second time,emitremmus27,Politics,7460,all
AOC says coronavirus bailout should ban stock buybacks — especially for airlines,jigsawmap,Politics,4216,all
"We Calculated How Much We Pay Trump to Play Golf. It Turns Out, He's America's 10th Highest Paid Athlete",idaell,Politics,3073,all
Megathread: President Trump Directed His Attorney To Lie To Congress About The Moscow Tower Project,PoliticsModeratorBot,Politics,29648,all
"Ohio city to stop observing Columbus Day, make Election Day holiday instead",emitremmus27,Politics,2242,all
Megathread: Bernie Sanders ends 2020 Democratic presidential bid,PoliticsModeratorBot,Politics,73912,all
The Republicans who were once so pro-life they fought over one woman on life support now want to sacrifice grandma for the economy,DaFunkJunkie,Politics,4502,all
Alexandria Ocasio-Cortez Says Lawmakers Should Lose Their Salaries Too When They Shut Down the Government,RationalAnon,Politics,4023,all
Alexandria Ocasio-Cortez called for Sen. Richard Burr's resignation after he reportedly sold off $1.7 million in stocks after reassuring the public of US preparedness during the coronavirus outbreak,jigsawmap,Politics,2885,all
'A Red Line Crossed': Nationwide Protests Declared for Thursday at 5PM After Jeff Sessions Fired,WagTheKat,Politics,8253,all
"Bernie Sanders: “President Trump is a socialist, too, but here’s the difference: The difference between my socialism and Trump’s socialism is I believe the government should help working families, not billionaires.”",nnnarbz,Politics,3928,all
"Trump is refusing to unveil Obama's portrait at the White House, breaking a 40-year tradition",geoxol,Politics,8748,all
The FCC has unveiled its plan to repeal its net neutrality rules,sureillberightthere,Politics,5724,all
"As Trump Says 'Voting Is An Honor' in Rant Against Mail-In Ballots, Progressives Respond: 'Voting Is a Right' - ""Voting isn't a gift given by leaders. Citizens have the right to vote.""",Pomp_N_Circumstance,Politics,5382,all
Resurfaced Video Shows Bernie Sanders Criticizing Media for Not Covering Climate Change in 1989,thesesforty-three,Politics,3771,all
"H.Res.755 - Impeaching Donald John Trump, President of the United States, for high crimes and misdemeanors",News2016,Politics,6517,all
"House Speaker Nancy Pelosi says the country must move toward vote by mail, setting up a fight with Trump",esteban-was-eaten,Politics,5417,all
Megathread: CEO Jack Dorsey says Twitter has decided to ban all political ads by candidates and outside groups,PoliticsModeratorBot,Politics,6829,all
Sanders raises over $2 million for coronavirus relief effort,grepnork,Politics,3878,all
Trump says he's directed Pence not to call governors who aren't 'grateful' for federal aid,technical_assistance,Politics,6811,all
Leaked audio: Trump adviser says Republicans 'traditionally' rely on voter suppression,nnnarbz,Politics,3246,all
Senate Passes Bill to Save Net Neutrality,zuppo,Politics,4114,all
The Anarchist Daughter of the GOP's Gerrymandering Mastermind Just Dumped All His Maps and Files on Google Drive,shill_hunter_x,Politics,4090,all
Trump walks out of press conference after altercation with female reporters,Sink-Em-Low,Politics,10018,all
"Trump’s campaign is trying to remove a video of him appearing to call the coronavirus a ‘hoax,’ saying it’s misleading",mcoder,Politics,4310,all
Sen. Kelly Loeffler sold at least $18 million more in stocks before the coronavirus crash than previously reported,bluestblue,Politics,2712,all
CNN and other news organizations were blocked Friday from a White House press briefing.,Inquitus,Politics,12921,all
The President Just Admitted in Court He Ran a Crooked Charity and We're All Just Gonna Shrug It Off?,TheGamerDanYT,Politics,3434,all
Fox anchor who dismissed coronavirus fears as plot to impeach Trump is removed from her prime-time slot,MemweatherDangle,Politics,3801,all
"Sanders Says If Israel Wants to Ban Members of Congress, It Should Not Receive Billions in US Military Aid",chris-jjj,Politics,6185,all
Fox News Anchor: ‘Conservatives’ Heads Would've Exploded’ if Obama Claimed ‘Total’ Authority,dingo8yobb,Politics,3756,all
Andrew Yang overtakes Pete Buttigieg to become fourth most favored primary candidate: Poll,ZachandMattShow,Politics,7981,all
Jewish leaders tell Trump he's not welcome in Pittsburgh until he denounces white nationalism,slingtarp,Politics,5548,all
"Leaked Draft of Trump Executive Order to 'Censor the Internet' Denounced as Dangerous, Unconstitutional Edict",Bakedschwarzenbach,Politics,7084,all
All References to Climate Change Have Been Deleted From the White House Website,dangzal,Politics,8737,all
Pelosi says she'd be comfortable with Sanders at top of ticket,jdickman78,Politics,5043,all
House votes 420-0 to make Mueller's report public,TheWeekMag,Politics,3809,all
"Sanders Applauds New Medicare for All Study: Will Save Americans $450 Billion and Prevent 68,000 Unnecessary Deaths Every Year",Bernie-Standards,Politics,4630,all
Nancy Pelosi won’t send the articles of impeachment to the Senate until she feels they’ll get a fair hearing.,Harvickfan4Life,Politics,8423,all
"Iraqi Parliament Votes to Expel All American Troops and Submit UN Complaint Against US for Violation of Sovereignty. ""What happened was a political assassination. Iraq cannot accept this.""",DaFunkJunkie,Politics,7090,all
#FireTrumpNotFauci Trends After President Goes After Trusted Infectious Disease Official,idarknight,Politics,3271,all
Video of Mike Pence Saying ‘Foreign Governments Cannot Participate in the American Political Process’ Goes Viral After Trump-Ukraine Scandal,thesesforty-three,Politics,2749,all
Fact check: McConnell claims Obama didn't leave Trump a pandemic 'game plan.' Obama left a 69-page playbook,jigsawmap,Politics,3925,all
It Should Terrify You That Senators Are Dumb Enough To Think No One Would Notice Them Dumping Their Stocks,neighborinotwink,Politics,1670,all
Ocasio-Cortez calls for 'answers' after Epstein found dead in jail cell,PsychSiren,Politics,8195,all
Bernie Sanders Says It Is 'Nauseating' to See Corporations Praise Frontline Workers as 'Heroes' While Refusing to Pay Them More,Innocul8,Politics,2690,all
"Bernie Sanders says he's staying in race, looks forward to debating Joe Biden",bluestblue,Politics,12860,all
"Majority says Election Day should be a federal holiday, poll finds",Bogartsboss,Politics,3241,all
Obama: If Republicans really cared about Clinton's emails they would be 'up in arms' over Trump's iPhone,Bogartsboss,Politics,3702,all
Trump ‘didn’t know people died from the flu.’ It killed his grandfather.,AmericanBornChink,Politics,4142,all
"'A Really Chilling Moment': Trump Refuses to Allow Dr. Fauci to Answer Question on Dangers of Hydroxychloroquine— ""This is unacceptable. Dr. Fauci, one of the world's top infectious disease scientists, was just censored live at a White House press conference.""",DonnyMoscow1,Politics,5282,all
"Andrew Yang: What good are record-high profits if we have record-high stress, anxiety, student loan debt",WendyPeffercorn6789,Politics,4528,all
Sanders overtakes Biden in New Hampshire poll,dank-nuggetz,Politics,6751,all
"Maloney Introduces Legislation to Save the Open Internet, Block FCC Rollback of Net Neutrality",brashendeavors,Politics,1680,all
The pandemic has made this much clear: those running the US have no idea what it costs to live here,thefunkylemon,Politics,4225,all
Cards Against Humanity buys plot of land on U.S./Mexico border to block border wall,Bammerice,Politics,6273,all
Megathread: Federal Judge Rules President Trump Must Turn Over Eight Years Of Personal And Corporate Tax Returns,PoliticsModeratorBot,Politics,14624,all
"Putting Trump's name on stimulus checks is ""abuse of government resources,"" says president of IRS managers association",screaming_librarian,Politics,4715,all
"Insurance Industry Corrects Trump: Actually, We're Only Waiving Copays for Coronavirus Testing, Not Treatment; ""Heaven forbid they miss a chance to bankrupt sick people.""",Thinkingonsleeping,Politics,5178,all
Elijah Cummings 'signed subpoenas from his hospital bed' for Trump impeachment before his death,Austin63867,Politics,2817,all
Senator McConnell Must Recuse - The Senator Has Already Violated His Oath as a Juror,nnnarbz,Politics,4718,all
A Message to PBS: Televise the Trump Impeachment Hearings for All to See,wonderingsocrates,Politics,2888,all
20 leading economists just signed a letter arguing Medicare for All would generate massive savings for American families,Plymouth03,Politics,3436,all
"Trump Campaign Secretly Paying $180,000 A Year To His Sons’ Significant Others | Lara Trump and Kimberly Guilfoyle are each receiving $15,000 per month through the campaign manager’s private company, GOP sources said, to dodge FEC rules.",nclobo,Politics,3024,all
The US stock market has now wiped out the entire $11.5 trillion of value it gained since Trump's 2016 election victory,AdventurousScientist,Politics,7093,all
Trump Livid After California Allows Statewide Mail-In Voting: ‘These Votes Must Not Count’,Twoweekswithpay,Politics,6604,all
Cuomo Reminds McConnell That KY Takes More Money Than NY: ‘Who’s Getting Bailed Out Here?’,Twoweekswithpay,Politics,4365,all
Bernie Sanders Wins the Nevada Caucuses,jigsawmap,Politics,5054,all
"Megathread: Trump adviser Roger Stone guilty on all seven counts of lying to congress, obstruction and witness tampering in relation to the Russia probe",PoliticsModeratorBot,Politics,11359,all
'The Public Deserves to Know': Lone Watchdog Demands Federal Reserve Release Names of Corporations Receiving Taxpayer Bailouts,newnemo,Politics,2246,all
"Susan Collins has failed the people of Maine and this country. She has voted to confirm Trump’s judicial nominees, approve tax cuts for the rich, and has repeatedly chosen to put party before people. I am running to send her packing. I’m Betsy Sweet, and I am running for U.S. Senate in Maine. AMA.",BetsySweet,Politics,2433,all
Federal Prosecutors ‘Concluded that President of the United States Committed a Felony’,progress18,Politics,5214,all
"Trump Just Removed the IG Investigating Elaine Chao. Chao’s Husband, Mitch McConnell, Already Vetted the Replacement.",stetoe,Politics,3760,all
Sanders says he'll enact national drinking water standards,puppuli,Politics,3042,all
"Mueller Subpoenas Trump Organization, Demanding Documents About Russia",throwaway5272,Politics,7454,all
"'My God,' Says US Senator After William Barr Deploys 'History Is Written by the Winners' Trope | ""The head of the American justice system now saying publicly that there is no good or bad except what the strongest want. The definition of autocracy.""",Fr1sk3r,Politics,4881,all
"Watch: In Fiery Floor Speech, Sanders Rips GOP for Relentless Efforts to 'Punish' Poor People — ""Meanwhile, these very same folks had no problem a couple years ago voting for a trillion dollars in tax breaks for billionaires and large profitable corporations. Not a problem.""",chris-jjj,Politics,4042,all
"Medical Journal Urges American Voters to Not Re-Elect Trump, Slams Him for Coronavirus Response",Reddit_guard,Politics,3299,all
"Senate bill to reverse net neutrality repeal gains 30th co-sponsor, ensuring floor vote",They_always_watch,Politics,2368,all
Mensa offers to host IQ test for Trump and Tillerson,Trumps-is-a-Bitch,Politics,5208,all
Sanders: 'Your $8.99 Netflix subscription is more than the company paid in federal income taxes',Conells,Politics,4738,all
The sheriff fired her because she’s a lesbian so she ran for his office. She demolished him.,HyacinthFT,Politics,1914,all
Bernie Sanders says he would legalize marijuana on his first day as president,Crawl-Walk-Run,Politics,4128,all
Keep Audiences Out of Debates—Forever,chiaconan,Politics,2051,all
Trump Has ‘Financial Interest’ in Hydroxychloroquine Manufacturer: NYT,DAXTrading,Politics,5102,all
Elizabeth Warren proposes a lifetime lobbying ban for major government officials,TheWeekMag,Politics,2785,all
Sen. Kelly Loeffler Dumped Millions in Stock After Coronavirus Briefing,Mateony,Politics,3903,all
"Sanders: 'Obviously I am not a communist,' but maybe Trump 'doesn't know the difference'",DaFunkJunkie,Politics,4994,all
The worst president. Ever.,mepper,Politics,8508,all
"More than 800K physicians beg Trump to let experts, not holidays, determine when public gatherings are safe again",a_very_nice_username,Politics,2510,all
"Obama Slams Dropping Of Michael Flynn Case, Calls White House COVID-19 Response 'Absolute Chaotic Disaster'",sketch24,Politics,4748,all
"Ruth Bader Ginsburg says she is starting 2020 ""cancer free""",Fr1sk3r,Politics,2001,all
"Dem introduces bills to eliminate electoral college, stop presidents from pardoning themselves",Ayrane,Politics,5761,all
"On a call with Trump officials, police chief pleads: 'Stop testing NBA players, start testing first responders'",MemweatherDangle,Politics,3147,all
Megathread: President Donald Trump Removes Watchdog Overseeing Rollout of $2 Trillion Coronavirus Bill,PoliticsModeratorBot,Politics,8739,all
The Video of Donald Trump Telling Associates to “Get Rid of” Ambassador Marie Yovanovitch Has Been Released,smellslike__updog,Politics,4615,all
#ILikeBernie Trends After Hillary Clinton Says 'Nobody Likes' Bernie Sanders,nnnarbz,Politics,8451,all
The Coronavirus Is the Worst Intelligence Failure in U.S. History | It’s more glaring than Pearl Harbor and 9/11—and it’s all the fault of Donald Trump’s leadership.,system_exposure,Politics,4271,all
Comey Memo Says Trump Asked Him to End Flynn Investigation,VisionLikeAHawk,Politics,13972,all
"Mueller Draft Report says Trump 'Helped Putin Destabilize the United Sates', Watergate Journalist says",JohnBasedow_,Politics,6373,all
"Ocasio-Cortez Says Putting Pence in Charge of Coronavirus Effort Is 'Irresponsible' Because He 'Literally Does Not Believe in Science' — ""This decision could cost people their lives. Pence's past decisions already have.""",DonnyMoscow1,Politics,4366,all
Major Producer of Hydroxychloroquine Once Paid Michael Cohen Hefty Sum for Access to Trump,Twoweekswithpay,Politics,2991,all
First charges filed in Mueller investigation,FromJersey4,Politics,14224,all
"Sanders condemns his supporters' 'ugly, personal attacks' against Warren",austinexpat_09,Politics,9851,all
Trump’s ‘Liberate Michigan!’ tweets incite insurrection. That’s illegal. | Federal law bans advocating the overthrow of government.,ohnoh18,Politics,7202,all
Dan Rather asks Trump what’s more ‘marginal’: ‘Believing in Santa at age 7 or not believing in climate change at age 72?,Baarney23,Politics,2558,all
"H.Res.757 - Calling for the resignation and disbarment of United States Attorney General William P. Barr, and for other purposes.",chodeboi,Politics,2296,all
US spies say Trump's G7 performance suggests he's either a 'Russian asset' or a 'useful idiot' for Putin,dingo8yobb,Politics,4091,all
Navy Captain Removed From Carrier Tests Positive for Covid-19,aggie_ftfy,Politics,2245,all
Megathread: AP Calls Alabama Senate Special Election for Democrat Doug Jones,PoliticsModeratorBot,Politics,25717,all
Trump has concealed details of his face-to-face encounters with Putin from senior officials in administration,danielthetemp,Politics,4707,all
#ArrestRandPaul trends on Twitter after he walks out over impeachment question,MrsBuck2u,Politics,4530,all
Megathread: Michael Cohen pleads guilty to lying to Congress about Trump real estate project in Russia,PoliticsModeratorBot,Politics,14428,all
America doesn’t want another Tea Party - Don’t let Fox News fool you. 81% of Americans do not share the views of anti-quarantine protesters.,_hiddenscout,Politics,2898,all
Ocasio-Cortez: 'Members of Congress should not be allowed to own individual stock',DaFunkJunkie,Politics,2191,all
Giuliani associate willing to tell Congress Nunes met with ex-Ukrainian official to get dirt on Biden,_NewsClues_,Politics,5744,all
"'Literally What Jesus Told People to Do': In Arizona, Possible Prison Time for Leaving Food and Water for Migrants — ""If giving water to someone dying of thirst is illegal, what humanity is left in the law of this country?""",a_very_nice_username,Politics,3956,all
Bill Gates says we can’t restart the economy soon and simply “ignore that pile of bodies over in the corner”,silence7,Politics,2889,all
Trump claims the media misrepresented his coronavirus cure comments. Video proves otherwise. The president is now routinely lying about things we saw with our own eyes and that are on tape.,jigsawmap,Politics,4370,all
Trump vows 'no more' federal aid to California as devastating wildfires continue to burn,NoKidsItsCruel,Politics,7460,all
The Trump Organization Planned To Give Vladimir Putin The $50 Million Penthouse In Trump Tower Moscow,kerovon,Politics,5137,all
Megathread: Bernie Sanders announces 2020 presidential run,PoliticsModeratorBot,Politics,38369,all
Alexandria Ocasio-Cortez's 'Corruption Game' Speech Is Now the Most Viewed Twitter Video of Any Politician,nrmlgir111,Politics,4693,all
House passes bill to require presidents to disclose their tax returns,ONE-OF-THREE,Politics,2455,all
Trump now claims he spoke 'sarcastically' when repeatedly suggesting people inject disinfectant to cure coronavirus,jigsawmap,Politics,6711,all
Twitter names Trump the 'Tide Pods' president after he suggests disinfectant injections,bigjawgiggy,Politics,3819,all
Trump impeachment hearing opened by Congress for first time,zukusenryuuu,Politics,3711,all
"After Life of Incalculable Harm, Billionaire Climate Denialist and Right-Wing Villain David Koch Dead at 79",JLBesq1981,Politics,6242,all
Trump White House edits Putin support for Trump out of transcript and video,darkfires,Politics,3671,all
99.7 Percent of Unique FCC Comments Favored Net Neutrality,speckz,Politics,2054,all
"Most Americans would rather spend the $5 billion Trump is demanding for the border wall on infrastructure, education, or healthcare",The-Autarkh,Politics,4213,all
"“There will be a [Senate] vote” to reinstate net neutrality, Schumer says",mvea,Politics,2399,all
Ajit Pai admits Russia interfered in net neutrality process amidst lawsuit,speckz,Politics,2459,all
"New documents show Trump kept 2 sets of books for his biggest property in Manhattan, pointing to potential financial fraud",roku44,Politics,3570,all
Adam Schiff Erupts: Closing Statement On Contentious Impeachment Hearing,MainEchidna0,Politics,5981,all
"Bernie Sanders Warns Total Economic Collapse Will Be More Expensive Than Paying Workers, Reducing Health Care Costs Amid Coronavirus",Plymouth03,Politics,3154,all
"Bernie Sanders: We need scientists, not politicians, in charge of the coronavirus response | Let scientists and health professionals take charge. Stop spreading lies and focus on minimizing the risk and addressing health care needs.",Tiggles_The_Tiger,Politics,1817,all
Trump Suddenly Loses Interest In Briefings After Disastrous Disinfectant Comments,qdude1,Politics,4627,all
"GOP Senator Kept Coronavirus Info Secret for Weeks, But Shared It With Wealthy Donors",Mateony,Politics,2654,all
Source: Leaked Documents Show the U.S. Government Tracking Journalists and Immigration Advocates Through a Secret Database,slakmehl,Politics,2677,all
Mitt Romney sides with Democrats calling for $12 hourly raises for essential workers,WorkTomorrow,Politics,3388,all
Megathread: Ex-Trump adviser Roger Stone arrested in Mueller probe,PoliticsModeratorBot,Politics,21571,all
Bernie Sanders Is the Only Leading Presidential Candidate Pledging to Vote Against the Patriot Act,isaac-get-the-golem,Politics,2527,all
'Trump kept saying it was basically pretty much a cure': Woman whose husband died after ingesting chloroquine warns the public not to 'believe anything that the president says',The-Autarkh,Politics,7044,all
Republicans Are Sneaking Abortion Restrictions into the Coronavirus Bill. Anti-choice lawmakers are stalling emergency legislation.,easyone,Politics,4387,all
Superdelegate pushing convention effort to stop Sanders is health care lobbyist who backed McConnell,DaFunkJunkie,Politics,3842,all
Pelosi says Democrats to introduce bill to bring back net neutrality this week,Kujobites,Politics,2340,all
"'I cannot stress this enough, this will kill you': Fox News host Neil Cavuto was shocked by Trump's announcement that he's taking hydroxychloroquine to prevent coronavirus",Sarbat_Khalsa,Politics,5679,all
"Texas closes hundreds of polling sites, making it harder for minorities to vote",Thinkingonsleeping,Politics,4479,all
Trump Campaign Aides Had Repeated Contacts With Russian Intelligence,regularly-lies,Politics,11855,all
AOC Calls for WH Adviser Stephen Miller to Resign After Emails Show He Promoted White Nationalism,wonderingsocrates,Politics,3339,all
"Man Boasts Of Sexual Assault, Later Inaugurated 45th President Of United States",loremipsumchecksum,Politics,9998,all
Senator Dumped Up to $1.6 Million of Stock After Reassuring Public About Coronavirus Preparedness,Mateony,Politics,1725,all
Megathread: US Government Accountability Office finds Trump administration violated the law by freezing Ukraine aid,PoliticsModeratorBot,Politics,9873,all
Yovanovitch gets standing ovation at the end of 5-hour hearing,WalmartVirgin,Politics,4926,all
"Marco Rubio took almost $100,000 from Betsy Devos' family before confirming her today.",relevantlife,Politics,3732,all
Alexandria Ocasio-Cortez Exposes The Dark Side Of Politics In 5 Incredible Minutes,Fr1sk3r,Politics,8543,all
Trump reportedly said he would reject a bailout package if it included aid to keep the US Postal Service functioning,TrumpSharted,Politics,5725,all
"Coronavirus tragedy should lead to ""rethinking"" American society, Bernie Sanders says",swingadmin,Politics,4310,all
