Submission Title,Submission Author,Subreddit,Number of Comments,Time Filter
The Cosmic Irony of Bernie Sanders’s Rise - What makes Bernie Sanders so threatening to the Democratic establishment is that he stands for what millions of Democrats thought their party stood for all along.,snakeinyourgrass,Politics,2621,all
"Ocasio-Cortez Says Trump Is a 'Monster' for 'Threatening to Target and Kill Innocent Families, Women, and Children' in Iran",futuredude,Politics,4861,all
Nurses read names of colleagues who died of COVID-19 in protest outside White House,TrumpSharted,Politics,1579,all
Trump Org charged taxpayers eight times more for Secret Service stays than it claimed: documents,jigsawmap,Politics,1904,all
"Republicans tried to rig the vote in Michigan – but ‘political novices’ just defeated them: After a Republican bragged about cramming ‘Dem garbage’ into certain districts, a grassroots campaign has given the power to redraw political maps to the people",chaos_DC,Politics,1669,all
Maxine Waters unleashes over Trump COVID-19 response: 'Stop congratulating yourself! You're a failure',wbedwards,Politics,2412,all
President Trump Really May Go to Jail—For the Rest of His Life,HuitlacocheBanana,Politics,7386,all
Sean Spicer Out as Press Secretary,RealKimJongUn,Politics,4864,all
"71% of republicans want mitch mcconnell to call witnesses at trump impeachment trial, new poll shows",That49er,Politics,2075,all
Trump calls for cutting National Science Foundation funding by $1 billion,BlankVerse,Politics,3141,all
Don’t sugarcoat this. Trump just called for 32 million people to lose health coverage.,Thue,Politics,6401,all
"Trump 'regularly stumbles, slurs and gets confused', White House official says | ‘It’s like showing up at the nursing home at daybreak to find your elderly uncle running pantsless across the courtyard,’ says anonymous author",Face2FaceRecs,Politics,4209,all
Trump campaign 'still hasn't paid security bills for rallies to at least six cities',MemweatherDangle,Politics,1838,all
Senate Republicans block emergency sick leave bill as outbreak spreads across US,NoKidsItsCruel,Politics,2940,all
New Ukraine Emails Prove White House Lied to Congressional Investigators,Mateony,Politics,2559,all
Schumer suggests McConnell is blocking election security measures because he wants ‘the Russians to interfere’,PoliticalScienceGrad,Politics,2633,all
'I won’t be reading ET again!': Trump attacks Christian magazine for backing impeachment then misspells its name during wild early morning rant,nnnarbz,Politics,4173,all
"Almost 50% of Americans say Donald Trump will go down in history as a ""poor"" or ""below average"" president, a new poll finds",menstrual_discharge,Politics,4224,all
Mitch McConnell is pushing the Senate to pass a law that would let the FBI collect Americans' web browsing history without a warrant,jaymar01,Politics,2596,all
"Fox News judge says House impeachment inquiry ""consistent with the rules"" that ""Republican majority"" signed into law",banned_for_,Politics,2437,all
John Kelly Confirms He Was Lying All Along: The White House Is in Chaos,arandomnewyorker,Politics,2189,all
Trump's motorcade greeted with chants of 'lock him up' in NYC,SimulationMe,Politics,3122,all
Sean Spicer thinks it's 'somewhat sad' people are still talking about the election. President Trump has mentioned it every day for the last week.,RosesAreBad,Politics,2208,all
Manafort held secret talks with Assange in Ecuadorian embassy,Chuffnell,Politics,6260,all
11 Million Taxpayers Losing $323 Billion In Deductions In Trump Tax Hit,CavePrisoner,Politics,5056,all
Fox News Guest Says Trump Voters Should Pay for Border Wall by Crowdfunding It,Innocul8,Politics,4833,all
Trump Is Compromised by Russia,freddiethebaer,Politics,3755,all
Trump shouted down CNN’s Jim Acosta as ‘fake news’ then took a question from Breitbart.,relevantlife,Politics,14709,all
A sexual assault allegation against Joe Biden has ignited a firestorm of controversy,ohyeeeeaaahhh,Politics,11922,all
"Robert Mueller Is Going After Shady Democrats Now, Too",marron12,Politics,5170,all
"Support for Donald Trump's Impeachment is Higher Than His Approval Rating, New Poll Shows",iawake,Politics,2840,all
Reddit Says It’s Cooperating With Russia Investigations. They’ve Handed Over Zero Documents.,holymolym,Politics,3716,all
Donald Trump's travel expenses in 10 weeks cost US taxpayers as much as Barack Obama spent in two years,jolly2017,Politics,3567,all
Dr. Fauci Shuts Down ‘Fox & Friends’ on Coronavirus Cure: ‘We Don’t Operate on How You Feel’,zukusenryuuu,Politics,3143,all
DNC votes unanimously to no longer accept money from fossil fuel companies,,Politics,2501,all
CNN obtains secret Trump-Cohen tape,mvanigan,Politics,7218,all
Pelosi on calling Trump 'morbidly obese': 'I didn't know that he would be so sensitive',Balls_of_Adamanthium,Politics,5095,all
"Holder: If Trump directed Cohen to lie, impeachment proceedings ‘must begin’",Gambit08,Politics,2898,all
Trump is just 67 votes away from being an ex-President and it's freaking him out,wizardofthefuture,Politics,4274,all
Turns Out A Lot of Christians Are Against Trump's Pro-Christian Agenda. A new group called Christians Against Christian Nationalism has formed to fight for the rights of other religions in the U.S.,drsleep007,Politics,2726,all
Dems erupt into 'USA' chant on House floor after Hoyer gives fiery anti-Putin speech,Intern3,Politics,5425,all
Biden demands justice for Georgia killing of black jogger Arbery,AuburnSeer,Politics,6927,all
The only official fired over the virus? A captain who tried to protect his crew.,IntnsRed,Politics,1632,all
Bernie Sanders Says Pandemic Made Clear the 'Irrationality of the Current System',roku44,Politics,2188,all
MSNBC Won't Air Trump's July 4th Event Live,Creasy007,Politics,3717,all
'Romney's in isolation? Gee that's too bad': Trump appears to mock senator's coronavirus threat,technical_assistance,Politics,3256,all
Megathread: Andrew Yang Suspends 2020 Presidential Campaign,PoliticsModeratorBot,Politics,14032,all
Alexandria Ocasio-Cortez says all Americans should have the affordable healthcare she now gets as a congresswoman,Sayter,Politics,3686,all
Report: Michael Cohen plans to publicly accuse Trump of criminal conduct in office during dramatic testimony in front of Congress,Pomp_N_Circumstance,Politics,3729,all
We cannot allow the normalization of firearms at protests to continue,wbedwards,Politics,7017,all
Pelosi refers to McConnell as 'Moscow Mitch',burning_dawn,Politics,2742,all
Mitch McConnell Just Blocked A Bipartisan Bill To Protect Robert Mueller,wiseoldmeme,Politics,1982,all
Ocasio-Cortez: 'I want to see every Republican go on the record and knowingly vote against impeachment',TrumpSharted,Politics,3335,all
"In World War I remembrance, France’s Macron denounces nationalism as a ‘betrayal of patriotism’",Nibble_on_this,Politics,2674,all
Deceased GOP Strategist's Daughter Makes Files Public That Republicans Wanted Sealed,Hrekires,Politics,2029,all
"Biden releases plans to expand Medicare, forgive student debt",noarat,Politics,11663,all
Senator Says There Is 'Increasing Talk' That Mitch McConnell Should Recuse Himself From Impeachment Trial,Kunphen,Politics,2779,all
Previously Unreleased Defense Dept. Email Confirms Trump Made ‘Final Decision’ on Withholding Ukraine Aid,The-Autarkh,Politics,1782,all
A scathing new Pentagon report blames Trump for the return of ISIS in Syria and Iraq,Martin_Carson,Politics,2947,all
'We win': Trump appears to claim victory over coronavirus as US death toll jumps 129 in one day,grepnork,Politics,5137,all
"Mega Thread: Unsealed Michael Cohen documents reportedly implicate Trump, Hicks, others in 'hush-money' payments",PoliticsModeratorBot,Politics,10952,all
"House Intelligence Committee in possession of video, audio recordings from Giuliani associate Lev Parnas",shabuluba,Politics,2607,all
Pregnancy to cost 425% more under Donald Trump's health plan compared to Obamacare,pkvam,Politics,5637,all
Sanders Calls for Wasserman Schultz to Resign After Email Leaks,icaito,Politics,6559,all
Trump Impeachment Calls Surge as President Faces ‘Most Serious Scandal’ in U.S. History,Boonzies,Politics,6790,all
"2 attorneys general to subpoena Trump Organization, IRS",slakmehl,Politics,2306,all
Trump reportedly told aides he fears journalists will purposefully try to infect him with coronavirus on Air Force One,Twoweekswithpay,Politics,3874,all
McConnell won’t allow vote to bill to protect Mueller,viccar0,Politics,4069,all
"""I'm Not Willing to Do That"": Trump Says He Won't Take Climate Action Because It Would Threaten Corporate Profits",thesesforty-three,Politics,2991,all
Trump has handled the coronavirus the way he handles everything: Like a toddler,OwnRules,Politics,3152,all
"GOP attacked Obama as an ""amateur,"" but Trump gets a pass because ""he's new to this""",DONNIE_THE_PISSHEAD,Politics,2980,all
"President Trump hits majority disapproval in record time, Gallup finds",cameronj,Politics,5971,all
"Megathread: Manafort Shared Trump Campaign Data With Russian Associate, Prosecutors Say",PoliticsModeratorBot,Politics,5844,all
Most Americans say new Dem majority should publicize Trump tax returns: poll,sigseved,Politics,1803,all
"Trump Sons’ Romantic Partners Reportedly Receive $180,000 a Year From Reelection Campaign",billthomson,Politics,2033,all
State Dept. Was Granted $120 Million to Fight Russian Meddling. It Has Spent $0.,viccar0,Politics,2041,all
"Press briefing starts off with a bang, as reporter asks why the American people should trust anything the White House says",The-Autarkh,Politics,3014,all
'I didn’t say it': Trump falsely claims he never said US could test 5m a day for Covid-19 'very soon',hash0t0,Politics,2491,all
"Trump Could Feed Every Homeless Veteran For The Cost Of His Military Parade, Even Conservatively Estimated",WaitingPore,Politics,3635,all
It's Probably a Bad Sign If Your Political Success Depends on People Not Voting,ohnoh18,Politics,1601,all
Mass Arrests as Thousands Descend on Senate Office Building Demanding Lawmakers Reject Kavanaugh,ginger_bredman,Politics,5973,all
Trump tweets: The media is the 'enemy of the American people',71tsiser,Politics,11347,all
"Mitch McConnell blocked a resolution to release the full Mueller report, 3 days after saying he wanted 'openness and transparency' about it",lobsterbash,Politics,3004,all
Rand Paul blocks Senate vote on 9/11 victim compensation fund,DanishPastry789,Politics,4654,all
Presidential Historian: First Impeachment Article Against Nixon Was 'Obstruction By Directing Others To Lie',Creasy007,Politics,2111,all
Barack Obama Volunteers at Food Bank for Thanksgiving While Donald Trump Plays Golf in Florida,BEARlovesCOOKIE,Politics,2947,all
"Under The Bus You Go, Rudy: Trump Claims He Didn’t Tell Giuliani To Go To Ukraine",MCBbbbuddha,Politics,2830,all
Joe Walsh: 'I'd rather have a socialist in the White House than a con man',Alec122,Politics,1900,all
She Got 5 Years For Voting Illegally Once. Paul Manafort Got Less Time For Years Of Cons.,tt12345x,Politics,1598,all
Rep. Mia Love wants to limit congressional bills to one subject at a time,drewiepoodle,Politics,2492,all
65 percent of U.S. adults say Donald Trump was too slow to respond to COVID-19 outbreak: poll,Zhana-Aul,Politics,2118,all
Never-Before-Seen Trump Tax Documents Show Major Inconsistencies | The president’s businesses made themselves appear more profitable to lenders and less profitable to tax officials. One expert calls the differing numbers “versions of fraud.”,The-Autarkh,Politics,2761,all
Megathread: Trump Tells Freshman Congresswomen to 'Go Back' to the Countries They Came From,PoliticsModeratorBot,Politics,17983,all
Lev Parnas releases recording of Trump dinner: Full video,MTDreams123,Politics,2854,all
Donald Trump's Sexual Assault Accusers Demand Justice in the #MeToo Era: 'We Were Forgotten',Plymouth03,Politics,2898,all
Report: Trump's lawyer hand-delivered Michael Flynn a plan to lift sanctions on Russia,billionwires,Politics,4730,all
Trump asked intelligence chiefs to push back against FBI collusion probe after Comey revealed its existence,,Politics,5760,all
White House admits Trump's Ukraine phone call record was moved to secret server,nnnarbz,Politics,4648,all
The Dow just lost all of its gains since President Trump took office,palm___tree,Politics,5343,all
Megathread: Reports: Michael Flynn To Plead Guilty To Making False Statements To FBI,PoliticsModeratorBot,Politics,15163,all
Trump family trips cost taxpayers $11.3m in one month – almost as much as Obama’s cost in a year,cratermoon,Politics,4217,all
Whistleblower painstakingly gathered material and almost single-handedly set impeachment in motion,Showmethepathplease,Politics,3566,all
Billionaire Tells Wealthy To 'Lighten Up' About Elizabeth Warren: 'You're Not Victims',PepeBabinski,Politics,3999,all
Trump son-in-law Jared Kushner owns Baltimore area housing projects that have racked up hundreds of building code violations,Treasonmanbad,Politics,1964,all
Trump told Russian officials in 2017 he wasn’t concerned about Moscow’s interference in U.S. election,Austin63867,Politics,2984,all
Bernie Sanders Proposes Ending All Corporate Giving in U.S. Elections,abudabu,Politics,1842,all
Comey to Trump: ‘Release all the tapes. I’m good with it.’,amjadayub,Politics,5123,all
Bernie Sanders asks Elizabeth Warren and her supporters for backing,CrassostreaVirginica,Politics,10210,all
Dr. Anthony Fauci and Gov. Andrew Cuomo are the most trusted leaders in America on coronavirus right now. Trump is not.,skoalbrother,Politics,2103,all
The Navy Has Decided To Restore Capt. Brett Crozier,whubbard,Politics,1291,all
"US capitalism’s response to the pandemic: Nothing for health care, unlimited cash for Wall Street",the_new_fatality,Politics,2541,all
CNN’s Coverage of Sanders Was 3X More Negative Than Biden Following Their Big Primary Wins. A tale of two media narratives.,roku44,Politics,3769,all
Trump “Charity” Exposed as Elaborate Scheme to Make Golf Debts Go Away,DJTHatesPuertoRicans,Politics,2806,all
Dem senator: Scandalous that troops at border will miss Thanksgiving for 'no national security reason',ado4586,Politics,2214,all
Trump attempts to smear coronavirus whistleblower after complaint released: 'I hear bad things about him',hash0t0,Politics,2088,all
Trump Doesn’t Want Voters to Know How Much His Family’s Trips Cost Taxpayers,viva_la_vinyl,Politics,2886,all
Navy SEAL who says he killed bin Laden: ‘A military parade is third world bulls---’,wonderingsocrates,Politics,3675,all
It Seems Robert Mueller Has the Evidence Needed to Charge Donald Trump Jr. Right Now,progress18,Politics,3570,all
Parnas: I’ll Release a Photo Each Time Trump Denies Knowing Me,ginger_bredman,Politics,2950,all
Donald Trump would have lost if Bernie Sanders had been the candidate,Psydonk,Politics,8996,all
A Rogue National Park Is Tweeting Out Climate Change Facts in Defiance of Donald Trump,,Politics,3179,all
Trump’s Order to Defy Subpoenas Is Itself Grounds for Impeachment,CapitalCourse,Politics,1906,all
"A firm donated $750,000 of fireworks to Trump's Fourth of July show — and Trump scrapped fireworks tariffs the same day",polit1cs,Politics,2140,all
Noam Chomsky: Bernie Sanders Campaign Didn’t Fail. It Energized Millions & Shifted U.S. Politics,Jons312,Politics,2666,all
"Mitch McConnell is right. Secure, open elections would elect more Democrats.",cmit,Politics,4560,all
"Megathread: President Trump Calls for Ukraine, China to Investigate Bidens",PoliticsModeratorBot,Politics,20788,all
Poll: Americans Trust James Comey Over Trump,Large_banana_hammock,Politics,2997,all
"Megathread: DOJ Inspector General report finds FBI's Russia probe justified, no bias found",PoliticsModeratorBot,Politics,6751,all
Megathread: Sec. of State Mike Pompeo Subpoenaed By Three House Committees For Failure To Produce Ukraine Documents,PoliticsModeratorBot,Politics,9475,all
Warren Says Trump Admin Is Preventing States From Obtaining Coronavirus Equipment: They’re Doing ’Worse Than Nothing’,alt213,Politics,2507,all
Rep. Joe Kennedy III: It’s time to legalize marijuana at the federal level,redditor01020,Politics,2349,all
Sanders campaign raised $34.5M in fourth quarter,Jeffmister,Politics,4851,all
Coronavirus Drives Calls for a General Strike and #NotDying4WallStreet,ralphbernardo,Politics,2402,all
Largest Veterans organization demands apology after Trump said traumatic brain injuries from Iranian attack are 'not very serious',shill_hunter_x,Politics,2116,all
Trump repeats false claim there is no climate change crisis as he brands science 'fake',lobsterbash,Politics,4048,all
"Megathread: Congress Can Seek President Trump’s Tax Returns, Appeals Court Rules",PoliticsModeratorBot,Politics,9928,all
"Fox News Defends Its COVID Lies, Saying First Amendment Protects “False” Speech",chris-jjj,Politics,3509,all
Megathread: Appeals Court Agrees President Trump Tax Returns Can Be Turned Over,PoliticsModeratorBot,Politics,9319,all
"Ocasio-Cortez: If US Has $5.7 Billion for Trump's Border Wall, What About Education, Healthcare, and Green Jobs?",SplodeyDope,Politics,4242,all
"One Million People Demand Trump’s Tax Return, Smashing Petition Record",wurstfinga,Politics,3230,all
Eric Trump funneled cancer charity money to his business: Report,Chituck,Politics,2516,all
We Need Independently Run Presidential Debates,,Politics,3056,all
"Iceland's Prime Minister Says She'll Skip Mike Pence's Visit, Citing 'Prior Commitments'",Mamacrass,Politics,2559,all
Sen. Mitt Romney tells Chris Wallace that President Trump should be removed from office,black-flies,Politics,2914,all
"Please Stop Thinking This Will Be a Fair Election: President Trump declared his willingness to betray the country, and Republicans are ready to help",wonderingsocrates,Politics,3623,all
Dem wants to publicly release the number of sexual harassment claims filed against senators,Davidwells2,Politics,1667,all
Jared Kushner Is Going to Get Us All Killed,hildebrand_rarity,Politics,3150,all
McCabe: 'I was fired because I opened a case against the president',Admiral_Red_Wings,Politics,2401,all
Andrew Yang proposes that your digital data be considered personal property,-AMARYANA-,Politics,4209,all
Presidential Executive Order Amending Executive Order 13223,pretendinglikeimbusy,Politics,10135,all
Credit Where It’s Due: Democratic Leaders Have Not Caved Like a Bunch of Weenies on the Border Wall,heinderhead,Politics,3508,all
Trump: The Most Corrupt President in US History,a_very_nice_username,Politics,4295,all
House Democrats launch official impeachment investigation,FamiNES,Politics,2930,all
"'In Chile, In Guatemala, In Iran': Sanders Applauded for Highlighting US Record of Overthrowing Governments Around the World; ""Nobody on the debate stage except Bernie has the guts to say the truth about the legacy of U.S. foreign policy.""",Thinkingonsleeping,Politics,3016,all
A watchdog out of Trump's grasp unleashes wave of coronavirus audits,grizzburger,Politics,1626,all
Sanders Alone On Debate Stage to Say Candidate With the Most Votes Should Get Nomination at Convention,speakhyroglyphically,Politics,6872,all
The Wrong Man Lost His Job Over the Navy’s Coronavirus Bungling | The captain who tried to save his crew deserves a medal. Trump’s Navy secretary removed him.,bluestblue,Politics,1374,all
Va. gov vetoes bill to defund Planned Parenthood,cyanocittaetprocyon,Politics,3705,all
Megathread: Flynn offers to testify for immunity deal.,PoliticsModeratorBot,Politics,17386,all
A protestor who called for Americans to 'eat babies' to fight climate change at AOC's town hall was revealed as a member of a pro-Trump fringe group,PleaseDeleteMeToDay,Politics,3268,all
"White House aggressively hunting ""executive time"" leaker who embarrassed Trump by revealing empty schedule",BelleAriel,Politics,2094,all
"Mike Bloomberg is the Donald Trump of democrats. If we vote him in, we sacrifice everything we stand for.",wimpyboyy,Politics,4852,all
House Judiciary Democrat: Kavanaugh Will ‘Likely’ Be Investigated for Perjury,emitremmus27,Politics,2934,all
Megathread: Bernie Sanders in narrow win over Buttigieg in the New Hampshire Democratic primary,PoliticsModeratorBot,Politics,23345,all
Donald Trump is less popular than Nancy Pelosi for the first time during his presidency,haxamin,Politics,3642,all
White supremacy-fuelled killings to be classed as domestic terrorism under new law proposed in New York,viva_la_vinyl,Politics,1914,all
Mitch McConnell Complains About Democrats Breaking Precedent. Internet Responds: Merrick Garland.,PM_ME_YOUR_TREASON,Politics,2173,all
Trump Says He Never Promised to Quickly Repeal Obamacare. Here’s a Bunch of Times He Promised Exactly That.,MechaSandstar,Politics,3197,all
"Democrats Not Headed Too Far Left, Says Ocasio-Cortez, 'We Are Bringing the Party Home': ""I want to be the party of the New Deal again,"" says the progressive congresswoman from New York. ""The party of the Civil Rights Act, the one that electrified this nation and fights for all people.""",nnnarbz,Politics,3740,all
"Sessions discussed Trump campaign-related matters with Russian ambassador, U.S. intelligence intercepts show",viccar0,Politics,6041,all
New Emails and Photo Show President Intervened Directly in Decision Not to Sell FBI HQ Property to Potential Trump Hotel Competitors,zzzigzzzagzzziggy,Politics,2513,all
New Report Says Dutch Have Absolute Proof Russia Was Behind 2016 Election Hacking,TrumpImpeachedAugust,Politics,4689,all
Republican Sen. Susan Collins is calling on the FCC to cancel the net neutrality vote,spacecyborg,Politics,1305,all
Porn star claims she’s free to talk after Trump lawyer violates non-disclosure deal,Maximuscorgi,Politics,5115,all
Notre Dame students walk out on Pence commencement speech,Nibble_on_this,Politics,5490,all
Trump held government workers hostage for a month — and walked away with nothing,jlew24asu,Politics,3487,all
Rod Rosenstein says the Russia probe has uncovered a widespread Russian effort to meddle in the 2016 race,The-Autarkh,Politics,2305,all
Intelligence officials 'extraordinarily frustrated' at Trump's refusal to pay attention during briefings,Veritaste,Politics,3252,all
Man Obsessed With Hillary Clinton’s Private Server Hid Documents On A Secret System,jingooftherex,Politics,1628,all
Child Dead In ICE Detention Center Due To ‘Negligent Care’: Immigration Lawyer,Psydonk,Politics,5257,all
Report: Alabama Mall Banned Roy Moore in the ’80s for Pursuing Teens,lovetrauma,Politics,3421,all
Trump now agrees with the majority of Americans: He wasn't ready to be president,progress18,Politics,5756,all
29-year-old Alexandria Ocasio-Cortez is poised to become the youngest woman in Congress,LostRapture,Politics,4737,all
'He's losing his s---': Trump's advisers are increasingly worried about his mental state following days of erratic behaviour,SpartanHeavy,Politics,4281,all
Wildly incriminating emails show the White House knew Trump was extorting Ukraine,WyldBlu,Politics,2691,all
Trump on China's Xi consolidating power: 'Maybe we'll give that a shot some day',krillindude890,Politics,6142,all
Ted Cruz Campaign Accused of Violating Texas Law with Deceptive Mailer Disguised as ‘Summons’,readet,Politics,2086,all
"'Apprentice' Contestant Says She Has Documents Corroborating Donald Trump Sexual Assault – Summer Zervos tells the court about calendar entries, old emails, correspondence with Fox News, and a polygraph test.",nnnarbz,Politics,2423,all
"Kris Kobach, who claimed misspelled names indicated voter fraud, misspells own name in Senate race registration",TheWeekMag,Politics,1229,all
IRS Says It’s Required to Turn Over Trump’s Tax Returns to Congress,corginamedzelda,Politics,2608,all
New York state judge rejects Trump claim that he can't be sued because he's president,progress18,Politics,1300,all
Trump Jr. insists that crimes committed before the election shouldn’t count,bbukbots,Politics,2620,all
Megathread 2: Michael Flynn testifies in plea that he was directed to make contact with Russia by senior Trump transition team officials,PoliticsModeratorBot,Politics,20493,all
"DeVos violated a court order to stop collecting on the debts of Corinthian College students. Now, they want her held in contempt.",newnemo,Politics,1439,all
Senate votes 100-0 to release Trump whistleblower complaint,TheWeekMag,Politics,2642,all
Syria signs Paris Agreement - leaving US only country in the world to refuse climate change deal,pankpankpank,Politics,3911,all
"Mitch McConnell is the only reason Trump hasn't seen a spending bill, says Alexandria Ocasio-Cortez",TheWeekMag,Politics,2680,all
Trump to Sign Spending Deal and Declare National Emergency at the Southern Border,PoliticsModeratorBot,Politics,29603,all
"Alexandria Ocasio-Cortez's 70% tax on the super-rich is more popular than Trump's tax cuts, new poll shows",relevantlife,Politics,5178,all
"Rex Tillerson on Trump: ‘Undisciplined,’ ‘doesn’t like to read' and tries to do illegal things",Veritaste,Politics,2395,all
Sarah Silverman Blasts GOP Hypocrisy for Telling Taylor Swift to 'Stay Out of Politics' but Giving Kanye West 'a Free Ticket to the White House',,Politics,3230,all
Obama says in private call that 'rule of law is at risk' in Michael Flynn case,SuccessfulOperation,Politics,4033,all
"Drop Out, Joe Biden",NoModerateRepublican,Politics,7823,all
Trump says Bahamas full of 'very bad gang members' as he doubles down on not letting hurricane refugees in to US,Mamacrass,Politics,3822,all
"Trump administration misled country with coronavirus testing data, Mitt Romney says",hash0t0,Politics,1688,all
Megathread: Paul Manafort ordered to jail after witness-tampering charges,PoliticsModeratorBot,Politics,8233,all
