Submission Title,Submission Author,Subreddit,Number of Comments,Time Filter
Biden says he won't legalize marijuana because it may be a 'gateway drug',Augie-Morosco,Politics,9203,all
Bernie Sanders rises to No. 1 in first post-Iowa national poll,BannerBearer,Politics,3179,all
Vice President Mike Pence tours Mayo Clinic without coronavirus mask even though he was told to wear one,jigsawmap,Politics,5448,all
Democrat wins Va. House seat in recount by single vote; creating 50-50 tie in legislature,slaysia,Politics,3608,all
Donald Trump tells AOC and Ilhan Omar to 'go back' to their 'original' countries,basicusername23,Politics,11136,all
"Sanders Unveils Plan to End Cash Bail, Ban Private Prisons, and 'Fundamentally Transform' US Criminal Justice System - ""If we stand together, we can eliminate private prisons and detention centers. No more profiteering from locking people up.""",Hoxha_Posadist,Politics,2777,all
"'Unacceptable': Dems Fume After Trump Announces Plan to Refuse Congressional Oversight of Corporate Bailout Funds - ""This is a frightening amount of public money to have given a corrupt admininistration with zero accountability.""",OldFashionedJizz,Politics,3792,all
"Rudy Giuliani butt-dials NBC reporter, heard discussing need for cash and trashing Bidens",ScotTheDuck,Politics,4063,all
"'They Are Saving Our Lives': Demand Grows for Grocery Store Employees, Other Frontline Workers to Receive Hazard Pay Amid Coronavirus Outbreak",rit56,Politics,1979,all
'I didn't do it': Trump shuns responsibility for cutting pandemic team before White House cuts mic of reporter asking 'nasty question',progress18,Politics,3470,all
"Biden, Sanders Demand 3-month Freeze on rent payments, evictions of Tenants across U.S.",masked-n-anonymous,Politics,5364,all
Chanting 'lock him up' to Trump at a World Series game is the most American thing ever — and I'm proud we did it,Antinatalista,Politics,4563,all
Border Patrol Detained a 9-Year-Old American Girl on Her Way to School for 32 Hours — It didn't matter that she had her U.S. passport with her.,Jons312,Politics,5745,all
Democrats to ask for 10 years of presidential tax returns in new bill,Intern3,Politics,3979,all
Michael Cohen’s Third Client is Sean Hannity,jsdow640,Politics,11294,all
"Trump Offered Assange Pardon if He Covered Up Russian Hack, Court Hears",HandSack135,Politics,3739,all
Take her out’: recording appears to capture Trump at private dinner saying he wants Ukraine ambassador fired,Austin63867,Politics,3962,all
Trump administration blocks states from using Medicaid to respond to coronavirus crisis,cogit4se,Politics,5580,all
Leaked McDonalds recording shows the company is fighting against parts of Trump's coronavirus bill that would give workers paid sick leave,austinexpat_09,Politics,2755,all
Trump Boasts He Likely Saved ‘Billions’ Of Lives In A Nation With 330 Million People,hash0t0,Politics,3761,all
"Sen. Flake, in a bombshell Senate-floor speech, 'Mr. President, I rise today to say: Enough.'",imagepoem,Politics,6116,all
The President of the United States Just Called the Emoluments Clause of the Constitution ‘Phony’,The-Autarkh,Politics,6245,all
Washington Senate passes bill that would keep Trump off 2020 ballot unless he releases tax returns,haxamin,Politics,4216,all
Obama: 'There's a pattern' of Republicans running the economy 'into the ground' and Democrats having to 'come back and clean things up',The-Autarkh,Politics,5320,all
"Leaked White House data shows infections spiking more than 1,000% in rural areas that backed Trump | Trump claims cases are falling everywhere. An unreleased task force report shows massive spikes in the heartland",ohnoh18,Politics,3762,all
Fox News Hosts Are Horrified to Learn Their Own Polls Show People Want to Tax the Rich,_basquiat,Politics,4662,all
Mitt Romney calls Trump's IG firings 'a threat to accountable democracy',hildebrand_rarity,Politics,3345,all
Mark Zuckerberg has been holding off-the-record dinners with influential conservatives including Tucker Carlson and Lindsey Graham,nnnarbz,Politics,3942,all
"'Obamagate' backfires: Documents show Biden, Obama acted properly",theC0nch,Politics,4086,all
"Sanders' 'Radical Goal'; At Least $60,000/Year for 'Every Teacher in America'",CharyBrown,Politics,7742,all
"More Than 2,000 Americans Have Died of the Coronavirus. Trump Is Tweeting About His TV Ratings.",relevantlife,Politics,3855,all
Trump invokes emergency powers to sidestep congress and sell arms to Saudi Arabia,GOPniks2,Politics,6265,all
Trump Administration Officials Arrested for Scamming Puerto Rico Out of $1.8 Billion in Hurricane Relief Funds,havenoideawatimdoin,Politics,2613,all
Trump threatens to adjourn both chambers of congress - something no president has ever done,jigsawmap,Politics,8708,all
House bill would ban stock trading by members of Congress,DaFunkJunkie,Politics,1290,all
"The Trump Administration Just Canceled an Order for 80,000 Ventilators to Haggle Over the Price",MemweatherDangle,Politics,4191,all
Trump attacked for spending '1 in every 5 days' at a golf club in 2019. President famously told voters in 2016 he would be too busy ‘working for you’ to play.,chelsea707,Politics,2357,all
"‘I would rather have a socialist in the White House than Donald Trump,’ says Republican Joe Walsh",NevadaRaised,Politics,3788,all
"Hi, I'm Stacey Abrams. If I win my ""toss up"" Georgia gubernatorial race, I'll be the first Black woman governor in America. Ask Me Anything!",staceyabrams,Politics,3043,all
"John McCain famously shut down a racist voter at a 2008 campaign event, now the video is going viral after Trump did nothing to stop racist chants at his rally",BlankVerse,Politics,4161,all
Trump caught on microphone congratulating himself about his Trudeau attack: 'That was funny when I said the guy's two-faced',JoseTwitterFan,Politics,4815,all
Children of US Troops Born Overseas Will No Longer Get Automatic American Citizenship,hunter15991,Politics,7008,all
"Megathread: U.S. House will draft Articles of Impeachment against President Trump, Speaker Pelosi announces",PoliticsModeratorBot,Politics,27980,all
Robert Mueller Is Investigating President Trump as a Russian Asset,throwaway5272,Politics,4826,all
Super Tuesday fury as ‘thousands of voters’ in black and Latino neighbourhoods forced to queue for hours in Texas; Voting rights expert says long queues are part of Republican 'voter suppression' tactic for 2020,Thinkingonsleeping,Politics,4949,all
"Wake up America, your country doesn't value your life",DaFunkJunkie,Politics,4513,all
Gay Marriage Legalized Nationwide by U.S. Supreme Court,awake-at-dawn,Politics,6357,all
Americans under the age of 30 support removing Trump from office by a nearly 3-to-1 ratio,greenblue98,Politics,4462,all
Sanders responds to Warren claim he fails to get things done with two-minute list of things he got done,MemweatherDangle,Politics,5810,all
Bernie Sanders leads Donald Trump by widest margin of all 2020 candidates: Election poll,CharyBrown,Politics,4794,all
The President Has Been Implicated in a Criminal Conspiracy,slakmehl,Politics,5616,all
Dem slams Trump: I won't be lectured on military needs by a 'five-deferment draft dodger',UWCG,Politics,4326,all
"Atheist Group Asks IRS to Probe Megachurch Over Pro-Trump Rally, Says Event Violates Rule Banning Political Participation",nnnarbz,Politics,2675,all
Obama says marijuana should be treated like ‘cigarettes or alcohol’,awake-at-dawn,Politics,7529,all
Bernie Sanders Says 'We Will Go to War Against White Nationalism and Racism',dingo8yobb,Politics,5289,all
17 women have accused Donald Trump of sexual misconduct. It’s time to revisit those stories,afattypanda,Politics,3818,all
Finland's millennial prime minister said Nordic countries do a better job of embodying the American Dream than the US,Bernie-Standards,Politics,5152,all
Decade in the Red: Trump Tax Figures Show Over $1 Billion in Business Losses,nanopicofared,Politics,6519,all
Michael Cohen Secretly Taped Trump Discussing Payment to Playboy Model,jjlew080,Politics,8188,all
Report: Mike Pence used private AOL email address to discuss Homeland Security issues,,Politics,5294,all
Megathread: Senator Mitt Romney Announces Vote to Convict President Donald Trump,PoliticsModeratorBot,Politics,16714,all
Trump tweets predicting Obama would start a war with Iran to get re-elected are coming back to haunt him,viva_la_vinyl,Politics,2816,all
Megathread: Ex-Trump lawyer Cohen gets 3 years in prison for crimes including hush-money payments that prosecutors say Trump ordered,PoliticsModeratorBot,Politics,15458,all
Pelosi says Trump doesn't get shutdown's effect on workers: 'He thinks maybe they could just ask their father for more money',Bogartsboss,Politics,4907,all
"Trump calls Trudeau 'two-faced', cancels press conference and leaves Nato summit early after video of world leaders making fun of him",chelsea707,Politics,6805,all
16 states sue President Trump over border wall,Cobrakai469,Politics,3957,all
Justice Department says it will end use of private prisons,ThorleBanana,Politics,467,all
Megathread: Mueller files final report with Attorney General,PoliticsModeratorBot,Politics,31829,all
Explosive ‘60 Minutes’ investigation finds Congress and drug companies worked to cripple DEA’s ability to fight opioid abuse,ahoyakite,Politics,2765,all
Progressive group that endorsed Warren switches to Sanders,jag316,Politics,4869,all
"Petition calling for release of Donald Trump's tax returns reaches 100,000 needed for White House response",,Politics,4124,all
Bernie Sanders rides enthusiasm to top showing in latest Iowa Poll,BiteYourThumbAtMeSir,Politics,3483,all
"Hillary Clinton Cleared of Mishandling Classified Information After 3-Year Private Email Probe, Trump So Far Silent",Fr1sk3r,Politics,4154,all
Bipartisan Constitutional Amendment to Overturn Citizens United Introduced,Ray3142,Politics,3140,all
"'Donald Trump is an Idiot,' Bernie Sanders Tweets on Saturday Afternoon",ToadProphet,Politics,4162,all
"AOC: 'In any other country, Joe Biden and I would not be in the same party'",wonderingsocrates,Politics,7752,all
#PresidentSanders Trends As Vermont Senator Reportedly Leads Democratic Fundraising Race,nnnarbz,Politics,4006,all
"Trump reportedly won't meet with Pelosi on a coronavirus bill, or for any reason, because he's mad at her",The-world-is-done,Politics,4669,all
Megathread: New York court orders President Donald Trump to pay $2 million for misusing his charitable foundation,PoliticsModeratorBot,Politics,6773,all
DeVos held in contempt for violating judge's order on student loans,HugeDetective0,Politics,2060,all
Megathread: Intelligence report claims Russia has compromising information on Trump,PoliticsModeratorBot,Politics,44048,all
Mitch McConnell Received Donations from Voting Machine Lobbyists Before Blocking Election Security Bills,emitremmus27,Politics,2184,all
White House May Have Broken Federal Law by Doctoring Trump-Putin Video,Armchair_QB3,Politics,3542,all
"I hope Jeffrey Epstein sings like a bird. And if some Democrats go down, so be it",shapu,Politics,6082,all
Judge orders White House to return Jim Acosta's press pass,Sepheus,Politics,4588,all
CNN Poll: Majority of Americans now say the federal government has done a poor job of preventing coronavirus spread,trifecta,Politics,4010,all
"Report: Saudis, UAE funnelled millions to Trump 2016 campaign",mepper,Politics,3124,all
"7-year-old migrant girl taken into Border Patrol custody dies of dehydration, exhaustion",lsThisReaILife,Politics,7115,all
Trump was impeached with more votes against him than any other president,viva_la_vinyl,Politics,4904,all
A Florida Massage Parlor Owner Has Been Selling Chinese Execs Access to Trump at Mar-a-Lago,thewateroflife,Politics,3088,all
#MassacreMitch Trends After Santa Clarita School Shooting: He's 'Had Background Check Bill On His Desk Since February',nnnarbz,Politics,5096,all
Sen. Richard Burr steps down as Senate intel chair during coronavirus stock sale probe,slaysia,Politics,1854,all
"Alexandria Ocasio-Cortez Asks Why Americans Will Fund Space Force, But Won't Back Health Care For All",newnemo,Politics,5626,all
"Verfiy: Bernie Sanders didn't propose a 52% tax rate on incomes over $29,000",TheGamerDanYT,Politics,3914,all
"Bernie Sanders unveils plan to boost broadband access, break up internet and cable titans",damrider,Politics,2900,all
Elon Musk Quits Trump's Advisory Councils After President Pulls US From Paris Accord,evewow,Politics,3481,all
#VoteThemAllOut2020 Trends as Trump's Republican Allies Stand Firm Behind the President During Impeachment Trial,nnnarbz,Politics,3252,all
Trump is telling Florida to ignore military ballots. Happy Veterans Day.,Cadet-Bone-Spurs,Politics,2823,all
"Whistleblower's Lawyers Say Trump Has Endangered Their Client as President Publicly Threatens 'Big Consequences'; ""Threats against a whistleblower are not only illegal, but also indicative of a cover-up.""",Thinkingonsleeping,Politics,4151,all
Sen. Bernie Sanders: Remove Stephen Bannon from National Security Council,mafco,Politics,4380,all
Donald Trump is warning “China will own the United States” if Joe Biden is elected president. But Trump himself is tens of millions of dollars in debt to China.,imago_deo,Politics,2738,all
'I can't imagine why': Trump says he takes no responsibility for people ingesting disinfectant despite telling them to,BringBckSheriffLobo,Politics,5050,all
Trump reportedly admitted impeachment played a big role in his Soleimani decision,pipsdontsqueak,Politics,3996,all
#Trumphatesmilitaryfamilies trends as administration to strip automatic citizenship right from some children of overseas troops,austinexpat_09,Politics,3558,all
Matt Gaetz Under Investigation By Florida State Bar Over Michael Cohen Threat,slaysia,Politics,2703,all
"As backlash against Trump’s ‘go back’ comments builds, here’s Ronald Reagan’s ‘love letter to immigrants’: ‘You can go to live in Germany, Turkey or Japan, but you cannot become German, Turk or Japanese. But anyone, from any corner of the Earth, can come to live in America and become an American.’",Treemailman,Politics,4417,all
'Unfit to be president': Full text of House impeachment resolution on Trump,Throwawaydude01928,Politics,5931,all
Trump’s Disinfectant Idea Is More Than a Silly Soundbite - it shows he is totally lost in managing the national response.,cranberryfix,Politics,4298,all
"Officials rejected Jared Kushner for top secret security clearance, but were overruled",Nutjob18,Politics,1936,all
Trump reportedly rejected aggressive coronavirus testing in hopes it would help his re-election,Fr1sk3r,Politics,4173,all
"Sarah Huckabee Sanders claims Donald Trump won the popular vote by ""overwhelming majority,"" when he lost by millions",PrincipledInelegance,Politics,5592,all
#Trumpsterrorists Trends As Americans Blame President Trump For Mass Shootings: 'The Blood Is On His Hands',ughsmugh,Politics,6984,all
Here Are the 51 Republican Senators Who Just Voted Against Expanding Paid Sick Leave to All Workers,Ryan_Holman,Politics,2691,all
Whitmer says Michigan protests 'depicted some of the worst racism and awful parts of our history',hanyhuh,Politics,4558,all
DeVos sued for seizing student loan borrowers' wages during pandemic,jdickman78,Politics,2374,all
Al Franken mocks McConnell: 'Like listening to Jeffrey Dahmer complain about the decline of dinner party etiquette',JLBesq1981,Politics,2706,all
Trump’s First 3 Years Created 1.5 Million Fewer Jobs Than Obama’s Last 3,cranberryfix,Politics,3472,all
The Trump Family Is Taking 12x More Protected Trips Than The Obama Family,LordOfTheDerp,Politics,2901,all
"Megathread: William Taylor, envoy to Ukraine, testifies Trump tied Ukraine aid to politically motivated investigations",PoliticsModeratorBot,Politics,12866,all
"Trump threatens to sue Minneapolis for demanding he pay for rally security in advance: Trump's campaign has stiffed at least 10 cities, going back to the 2016 campaign. Minneapolis won't stand for that",Thinkingonsleeping,Politics,3743,all
"Bernie Sanders' Medicare For All Policy Would Likely Increase Wages And Create Jobs, New Economic Analysis Shows",Plymouth03,Politics,4236,all
Megathread: Reports Indicate House Speaker Pelosi To Announce Formal Impeachment Inquiry Of President Trump,PoliticsModeratorBot,Politics,20970,all
McConnnell blocks resolution to release full Mueller report,scrotum_pot_pie,Politics,5870,all
Mueller: Manafort Has Lied To Investigators Since Plea Deal,singularfate,Politics,4406,all
The FCC Is Blocking a Law Enforcement Investigation Into Net Neutrality Comment Fraud,ONE-OF-THREE,Politics,1586,all
Megathread: Fmr. National Security Advisor John Bolton Alleges President Trump Tied Ukraine Funding to Investigation Into Bidens,PoliticsModeratorBot,Politics,9629,all
GOP Finally Has Documented Case of Election Fraud — Committed by Republicans,geoxol,Politics,2067,all
Yang calls out 'reality TV show' style elections that resulted in Trump: 'We need to be laser-focused',internetmaster5000,Politics,4869,all
Senate Intel report confirms Russia aimed to help Trump in 2016,jigsawmap,Politics,3059,all
Sean Hannity busted deleting all his old Michael Cohen tweets,SuccessfulOperation,Politics,2655,all
41% of Public More Likely to Support Universal Health Care Amid Pandemic,Plymouth03,Politics,2479,all
Megathread: Speaker Pelosi announces House to launch formal impeachment inquiry,PoliticsModeratorBot,Politics,18574,all
Bernie Sanders Politely Asks Supporters Not to Harass His Opponents,Cadet-Bone-Spurs,Politics,4893,all
PBS Going Gavel-to-Gavel With Trump Impeachment Hearings,LevitatingTurtles,Politics,2457,all
Trump says Mueller should not be allowed to tell congress about his obstruction: 'It will be bad for him',OutThinkz,Politics,4635,all
Trump rejected plans for a White House statement praising McCain,vwboyaf1,Politics,4654,all
"RBG Immediately Went There, Asked Trump Lawyer How Whitewater and Watergate Were Different from Tax Return Case",ClimbeRocker,Politics,3796,all
Schiff Introduces Constitutional Amendment to Overturn Citizens United,lobsterbash,Politics,2994,all
#ProtectMueller Protesters Shut Down Streets in Midtown Manhattan: “We Have to Resist”,Demon-Rat,Politics,3493,all
Donald Trump suggests he wants US law to limit free speech in wake of publication of explosive new book,StickyCertification,Politics,5347,all
Trump Has Spent $115 Million On Golf Trips ― Or 287 Years Of Presidential Salary,Minifig81,Politics,2947,all
An Alabama sheriff personally kept $1.5 million that was supposed to feed ICE detainees,lodestar_resistance,Politics,2535,all
Russia Doesn't Want Bernie Sanders. It Wants Chaos,Bernie-Standards,Politics,3874,all
Romney counters Trump: 90 percent of 'very Republican' Utah votes by mail,Al-Andalusia,Politics,2665,all
The White House accidentally emailed its Ukraine talking points to Nancy Pelosi,seamus_mc,Politics,5695,all
Trump met with 'lock him up' chants during Veterans Day Parade,BannerBearer,Politics,3305,all
"Megathread: Robert Mueller has agreed to testify publicly before Congress on July 17, House Judiciary and Intel Committees",PoliticsModeratorBot,Politics,8395,all
"Against all odds, it looks like Bernie Sanders might be the Democratic nominee after all",liquiddemocracy,Politics,4888,all
"Sanders responds to Clinton criticism: 'Unlike Secretary Clinton, I don't want to relive 2016'",Ph_Speed,Politics,7989,all
Trump has 62 percent disapproval rating in new AP poll,echo249,Politics,5021,all
"Donald Trump's Tab For MAGA Rallies Jumps To $1.8 Million As 14 Cities Say President Hasn't Paid Police Bills, Report Finds",Twoweekswithpay,Politics,2120,all
"Over 70 percent of voters support making 2020 presidential election entirely vote-by-mail, new poll shows",Canuknucklehead,Politics,2287,all
Alexandria Ocasio-Cortez’s “lightning round” on money in politics goes viral,lobsterbash,Politics,6283,all
"Donald Trump earns place in history with how America treats migrant children – At a detention center, kids have gone hungry and without beds. They've seen outbreaks of scabies, shingles and chickenpox. For those watching, this is what a national disgrace looks like",OtherMuffin,Politics,4892,all
Trump may have committed tax fraud by fabricating a loan to avoid paying income taxes on nearly $50 million,JLBesq1981,Politics,2472,all
"For the first time, Trump confesses that his campaign turned to Russia for help",AgentMouse,Politics,5075,all
Donald Trump's personal banking information handed over to Robert Mueller,saiidranktv2,Politics,7602,all
Fordham confirms that Trump team threatened the school if his grades became public,Drmanka,Politics,3521,all
Crowd chanting 'welcome home Ilhan' greets Omar at airport,noscreamattheend,Politics,3879,all
"Kyrsten Sinema wins, will become the first Democratic senator from Arizona in a quarter century",Demon-Rat,Politics,4009,all
Top Navy SEAL who oversaw the Osama bin Laden raid says the US is 'under attack from the president',M00n,Politics,2180,all
"Christianity Today receives boost in new subscriptions after calling for Trump’s removal, editor in chief says",TheGamerDanYT,Politics,2027,all
Virginia House passes bill to give electoral votes to popular vote winner,FortyYearOldVirgin,Politics,5082,all
Senators overseeing impeachment trial got campaign cash from Trump legal team members,Bobsind,Politics,1572,all
Trump calls for National Day of Prayer amid coronavirus pandemic — 'How about a national day of f*cking testing people for coronavirus.',a_very_nice_username,Politics,3281,all
House votes 362-53 to disapprove Trump lifting of sanctions on Russian companies,Throwawaydude01928,Politics,2105,all
Multiple Whistleblowers Raise Concerns about White House Transferring Sensitive U.S. Nuclear Technology to Saudi Arabia,guardiandevil,Politics,2988,all
Support For Donald Trump's Impeachment Is Now Higher Than His Approval Rating,Innocul8,Politics,5169,all
"Cambridge Analytica Bragged About Using Fake News, Bribes, And Ukranian Hookers to Influence Elections",stupidstupidreddit,Politics,4072,all
Comcast quietly drops promise not to charge tolls for Internet fast lanes,Philo1927,Politics,2507,all
One of Trump's personal valets has tested positive for coronavirus,Reddit_guard,Politics,4218,all
Trump denounces mail votes as corrupt – before admitting he applied for one,Mateony,Politics,2016,all
"Tulsi Gabbard Becomes Most Disliked Democratic Primary Candidate After Voting 'Present' On Trump's Impeachment, Poll Shows",roku44,Politics,5156,all
Author Stephen King Tells Iowans to Vote Out Steve King: ‘I’m Tired of Being Confused With This Racist Dumbbell’,,Politics,1499,all
"Romney, vilified in D.C. for vote to convict Trump, finds respect, support back home",Sanlear,Politics,2917,all
Ruth’s Chris Made $468 Million in Revenue but Gobbled Up $20 Million in Small Business Relief. The steakhouse chain has more than 150 locations and $86 million in cash reserves—and it furloughed workers.,DonnyMoscow1,Politics,2963,all
"As Trump Claims US Has Best Covid-19 Testing in the World, Capitol Physician Says He Lacks Capacity to Test All 100 Senators",idarknight,Politics,1740,all
President Trump Used the State of the Union to Call for an End to Investigations. So Did Nixon,tank_trap,Politics,3925,all
Fauci's absence from recent coronavirus briefings draws notice,DonnieMostDefinitely,Politics,2193,all
'Resign Or Be Impeached': Twitter Erupts Over Bombshell Trump Obstruction Report,melinda2020,Politics,6884,all
'CNN Is Truly a Terrible Influence on This Country': Democratic Debate Moderators Pilloried for Centrist Talking Points and Anti-Sanders Bias,RationalBassist,Politics,5030,all
"To Force Billionaires Off Welfare, Sanders Tax Would Make Corporations Fund 100% of Public Assistance Their Low-Paid Workers Receive",ideogon,Politics,5404,all
US official confirms that Trump tweeted out a picture from a classified intelligence briefing,jaymar01,Politics,4012,all
All 83 of the Ethics Complaints Against Justice Brett Kavanaugh Were Dismissed Because He's on the Supreme Court Now,,Politics,3576,all
Megathread: Office of Special Counsel Indicts 13 Russian Nationals and 3 Russian Entities for Interference in 2016 Election,PoliticsModeratorBot,Politics,20042,all
'Every American Should Be Outraged' Says Pandemic Expert About Government Response,nanopicofared,Politics,2723,all
Megathread: Senate votes not to call witnesses in President Donald Trump’s impeachment trial,PoliticsModeratorBot,Politics,28201,all
"Trump Campaign Adviser Pleads Guilty to Child Porn, Sex Trafficking",nnnarbz,Politics,3443,all
Megathread: Donald Trump met with boos and 'lock him up' chant at World Series Game Five,PoliticsModeratorBot,Politics,11750,all
"MSNBC Airs Jeffrey Epstein, Trump Mar-A-Lago Party Footage From 1992",animositisomina35,Politics,6343,all
"Winning: Trump Boos Reached ""Almost 100 Decibels"" at Nationals World Series Game",nnnarbz,Politics,5004,all
’21 Empty Seats’: More Than One-Third of GOP Senators Reportedly Left Room During Schiff’s Speech,hardsurface,Politics,4825,all
"Ted Cruz declines, so challenger Beto O’Rourke gets an hour on national TV by himself",whoiswillo,Politics,3624,all
EU Will Ignore White House And Work Directly With US States On Paris Agreement,cyanocobalamin,Politics,5514,all
"Pentagon Confirms Climate Change Is A National Security Threat, Contradicting Trump",hasibulhasanpro,Politics,1609,all
"Trump PR Stunt Falls Flat, as White House Video Exposes His Failure to Prepare for Pandemic",sigseved,Politics,4906,all
Justice Department to appoint special counsel to take over Russia probe,djnoseman,Politics,8846,all
"Bernie Sanders wants to put credit reporting companies like Equifax out of business | Sanders’s campaign is calling for a public credit registry, where you can get your credit score for free.",puppuli,Politics,2335,all
