Submission Title,Submission Author,Subreddit,Number of Comments,Time Filter
Trump publicly admits he fired White House official as retaliation for impeachment testimony: 'He was very insubordinate',nnnarbz,Politics,2832,all
Megathread: California governor signs bill requiring presidential candidates release tax returns to appear on ballot,PoliticsModeratorBot,Politics,14861,all
Let’s Never Forget That Trump and Fox News Started as Coronavirus Truthers,Canuknucklehead,Politics,2854,all
Trump Refused to Order Coronavirus Supplies Because Big Business Complained,i-am-sancho,Politics,3043,all
Trump fired Sally Yates the day she offered evidence Flynn was compromised,ursaslayer,Politics,4101,all
Michael Cohen implicated Trump in at least 11 different felonies,RyanSmith,Politics,3250,all
Trump Just Hired Jeffrey Epstein’s Lawyers,Eurynom0s,Politics,3293,all
Trump attacks protections for immigrants from ‘shithole’ countries in Oval Office meeting,billndotnet,Politics,13833,all
Trump says he won’t comply with key transparency measures in the coronavirus stimulus bill - The administration says it won’t provide documentation for audits into $500 billion in corporate bailout funds.,TrumpSharted,Politics,3743,all
Harrison Ford: America Has Lost Its Moral Leadership And Credibility,idc2011,Politics,3728,all
"Sen. Richard Burr, who sold stock before recent market decline, voted in 2012 against banning insider trading for Congress",derricknh,Politics,1406,all
Kushner loses access to top-secret intelligence,karmachanical,Politics,3779,all
Megathread: U.S. Intelligence Told Lawmakers of Russian Strategy to Boost Trump Re-Election,PoliticsModeratorBot,Politics,7910,all
"For the first time, a majority of Americans want the Senate to remove President Trump from office",Bakedschwarzenbach,Politics,2559,all
Trump Bragged On Tape Of Being Able To Do Exactly What Biden Is Accused Of,DaFunkJunkie,Politics,7596,all
"No, Mr. President, healthcare workers aren’t stealing masks. You failed them.",sketch24,Politics,2953,all
IRS turned over Nixon’s tax returns the same day that a congressional panel asked for them,wonderingsocrates,Politics,1824,all
Trump openly admitted on live TV to doing the thing he's accused of in the impeachment inquiry,avidjockey,Politics,4354,all
Trump: 'I have the absolute right to pardon myself',pipsdontsqueak,Politics,8269,all
Americans are going to demand to know why US wasn't prepared for this pandemic,cranberryfix,Politics,4878,all
House Judiciary Committee calls on Robert Mueller to testify,dantstk,Politics,3667,all
Democrats introduce constitutional amendment to overturn Citizens United,Whoshabooboo,Politics,3750,all
Sen. Dianne Feinstein unilaterally releases Fusion GPS testimony,marklarisunique,Politics,10637,all
Obama: How Hard Can It Be to Say 'Nazis Are Bad'?,Creasy007,Politics,6770,all
The coronavirus pandemic has shown that the trickle-down theory of economic growth is a total fabrication,chrisdh79,Politics,2383,all
Trump agrees to shut down his charity amid allegations he used it for personal and political benefit,Bloodbath-McGrath,Politics,4266,all
"Sessions spoke twice with Russian ambassador during Trump’s presidential campaign, Justice officials say",ipgof,Politics,8645,all
Donald Trump Jr says Obama never broke 2 percent GDP growth. He did. 15 times.,Nomandate,Politics,3323,all
Megathread: F.B.I. Raids Office of Trump’s Longtime Lawyer Michael Cohen,PoliticsModeratorBot,Politics,24326,all
"Trump said he wouldn’t cut Medicaid, Social Security, and Medicare. His 2020 budget cuts all 3.",bluestblue,Politics,2411,all
Bill would keep Trump off 2020 NJ ballot unless he releases his tax returns,hopopo,Politics,4434,all
Bernie Sanders finally wins California,Reddit_guard,Politics,6186,all
Democrat Ralph Northam elected governor of Virginia,slaysia,Politics,5676,all
Sen. Doug Jones introduces Back Pay Fairness Act to reimburse fed workers with interest,,Politics,1960,all
Calls for Barr to Be Investigated–and Possibly Impeached–Intensify After Lying to Congress About FBI Spying,nnnarbz,Politics,2250,all
Sanders rips Pence: His last response to an epidemic was to 'pray' it away,savvas_lampridis,Politics,2729,all
Disney CEO Bob Iger Resigns From Trump’s Advisory Council Over Paris Accord Decision,westcoast234,Politics,2103,all
Megathread: FBI Director Comey fired,PoliticsModeratorBot,Politics,41300,all
Watch: Donald Trump laughed at by U.N. General Assembly for claiming his administration is greatest in history,stupidstupidreddit2,Politics,6250,all
Flight attendant union calls for strike if government shuts down again,itsnewman17,Politics,3215,all
183 House Republicans just voted against resuming food safety inspection,heinderhead,Politics,3580,all
"“No one” in Puerto Rico has received stimulus checks, says San Juan mayor; The Treasury Department has sent out more than 88 million payments. Not one of them went to Puerto Rico",Thinkingonsleeping,Politics,3695,all
Megathread: Republican lawmakers introduce articles of impeachment against Deputy Attorney General Rod Rosenstein,PoliticsModeratorBot,Politics,15388,all
Trump Calls Legally Protected Whistleblowing a 'Racket' as Fired Scientist Rips President's Failed Covid-19 Response,Innocul8,Politics,2118,all
Trump Sued for Denying Checks to Americans Married to Immigrants,FOKOSW,Politics,2948,all
Obama tweets 'vote' after Trump promotes 'Obamagate',jigsawmap,Politics,3941,all
Ocasio-Cortez: 'Frustrating' that lawmakers oppose Medicare-for-All while enjoying cheap government insurance,relevantlife,Politics,3926,all
Key Mueller witness: I lied and I'm ready to die in jail,wonderingsocrates,Politics,4313,all
"Citing 'Utter Inability to Discharge Duties of His Office,' MoveOn Demands Trump Removal Under 25th Amendment",grepnork,Politics,2110,all
'Right Now Is the Moment to Decide If You Are Pro-Peace or Not': Ocasio-Cortez Joins Progressive Chorus Against War With Iran,RationalBassist,Politics,3923,all
"In Rare Joint Statement, U.S. and European Lawmakers Condemn Trump for ‘Abandonment’ of the Kurds",M00n,Politics,2195,all
"IRS: Sorry, but It’s Just Easier and Cheaper to Audit the Poor | Congress asked the IRS to report on why it audits the poor more than the affluent. Its response is that it doesn’t have enough money and people to audit the wealthy properly. So it’s not going to.",TJ_SP,Politics,2356,all
Peter Alexander on being called 'terrible reporter': I was just pitching Trump a 'softball' question,WyldBlu,Politics,3506,all
Trump's plan to cage kids indefinitely while denying them vaccines is ethnic cleansing in plain sight,tugboattomp,Politics,5562,all
"Trump ‘despises’ his own supporters and would be ‘disgusted’ by them, says ex-friend Howard Stern",masterven,Politics,5674,all
'The president knew everything': Key Trump impeachment figure unexpectedly arrives at Capitol Hill demanding to testify,Mateony,Politics,3046,all
Mike Pence staying at Trump golf resort in Ireland despite all meetings happening on other side of country US vice-president accused of corruption after decision to enrich boss' private business,Thinkingonsleeping,Politics,2347,all
"More Than 50,000 People Sign Petition Demanding Investigation Into DOJ's Roger Stone Reversal As Prosecutors Resign",nclobo,Politics,2318,all
"'Repulsive': Outrage as Texas Lieutenant Gov. Says Seniors Willing to Risk Coronavirus Infection to Protect Economy - ""This crisis is really laying bare the extent to which we are ruled by completely craven psychopaths.""",OldFashionedJizz,Politics,3738,all
Fox News Is Now a Threat to National Security. The network’s furthering of lies from foreign adversaries and flagrant disregard for the truth have gotten downright dangerous.,Pomp_N_Circumstance,Politics,3759,all
Megathread: Pete Buttigieg ends 2020 Democratic presidential bid,PoliticsModeratorBot,Politics,29400,all
Federal judge finds Georgia county violated Civil Rights Act by rejecting ballots,ado4586,Politics,2644,all
Betsy DeVos Could Face Jail After Judge Rules She Violated 2018 Order on Student Loans,BlackDog_II,Politics,2516,all
Justice Dept. preparing for Mueller report as early as next week,burning_dawn,Politics,6020,all
"Turkey Bombs US Special Forces In Syria Attack, Apparently By Mistake",shiruken,Politics,4529,all
#DeleteFacebook Trends After Report That Mark Zuckerberg Held Secretive Meetings With Conservative Influencers,bipbopbee,Politics,2902,all
"Mitch McConnell: My Bad, Obama Did Leave a Pandemic Playbook But I Couldn’t See It From Inside Trump’s Ass",ohnoh18,Politics,1462,all
"Megathread: AG Barr, Gaetz, AOC, others call for investigation into the death of Jeffery Epstein",PoliticsModeratorBot,Politics,15207,all
"Democrats won't let Fox News host primary debates, citing 'inappropriate' relationship with Trump",ericthedreamer,Politics,4031,all
"Susan Collins doesn't ""understand"" why voters turned on her. Did she forget her impeachment vote? 75% of Democrats and 51% of independents think Collins voted to acquit Trump in order to protect him politically",DaFunkJunkie,Politics,2313,all
"After CIA briefing, Republicans say 'no question' Saudi crown prince ordered Khashoggi murder",SetYourGoals,Politics,2290,all
Reddit Rises Up Against CEO for Hiding Russian Trolls,ThesaurusBrown,Politics,4858,all
Mueller Recommends Sentence of 19-24 Years for Paul Manafort,PoliticsModeratorBot,Politics,7808,all
"Bernie Sanders Promises to Legalize Marijuana Federally by Executive Order, Expunge Records of Those Convicted of Pot Crimes",behemoth1437,Politics,3188,all
Sarah Sanders Accused Of Sharing Doctored Infowars Video To Justify Acosta Ban,JoeinJapan,Politics,4509,all
"Oversight erased, Supreme Court hijacked: Trump turns the presidency into a dictatorship",last1yoususpect,Politics,6366,all
#MoscowMitchIsNext Trends After Republican Matt Bevin Loses Kentucky Governor's Race,nnnarbz,Politics,2210,all
Fox host: You can’t blame Dems for shutdown when “you’re in charge of everything”,shruggedit,Politics,5049,all
Megathread: Sen. Majority Leader Mitch McConnell Says GOP Lacks Votes To Block Impeachment Witnesses,PoliticsModeratorBot,Politics,9489,all
Trump has 'meltdown' during Syria meeting and has 'no plan' to deal with Isis,sloth_with_cigarette,Politics,5347,all
"'Stop This Illegal Purge': Outrage as Georgia GOP Removes More Than 300,000 Voters From Rolls; Warning of 2020 impact, one critic said Georgia could remain a red state solely ""due to the GOP purposefully denying people the right to vote.""",Thinkingonsleeping,Politics,4310,all
"It Is Beginning to Look Like the U.S. Has a Corruption Problem, Not Ukraine",DaFunkJunkie,Politics,3490,all
Republican presidential candidate Joe Walsh says Fox News and conservative radio are lying to Americans,mepper,Politics,2148,all
"Trump Says He's Aiming to Shield Corporations From Legal Liability for Workers Who Contract Covid-19 on the Job - ""Businesses are asking for the right to expose their workers to fatal risks with no consequences. It's bad economics and bad policy.""",OldFashionedJizz,Politics,3721,all
"Democrats Block Mitch McConnell's Coronavirus Bill, Calling It A 'Corporate Bailout'",BrautanGud,Politics,4265,all
Hawaii has decriminalized marijuana,AnonymousTank,Politics,1243,all
House Democrats unveil their first bill in the majority: a sweeping anti-corruption proposal,scrotum_pot_pie,Politics,4334,all
Nancy Pelosi: 'Morbidly obese' Trump shouldn't be taking hydroxychloroquine,lmeaac,Politics,5662,all
"Lindsey Graham Implicates William Barr in Massive Scandal, on Live Television",teslacoil1,Politics,4033,all
The Corporate Media’s War Against Bernie Sanders Is Very Real,srsly_its_so_ez,Politics,7135,all
Federal Judge Rules Trump Cannot Block House Subpoena Seeking Financial Records,PoliticsModeratorBot,Politics,7853,all
Bernie Sanders briefed by U.S. officials that Russia is trying to help his presidential campaign,IAmClaytonBigsby,Politics,10343,all
Demonstrators take to the streets in New York to rally for Trump impeachment,KAGsniper,Politics,2605,all
Megathread: Trump Administration Declines to Enact New Russia Sanctions,PoliticsModeratorBot,Politics,12967,all
"Megathread: House Democrats unveiled two articles of impeachment against President Trump, abuse of power and obstruction of Congress.",PoliticsModeratorBot,Politics,24093,all
GoFundMe is refunding all donations made to the 'Build the Wall' fundraiser,TJ_SP,Politics,3123,all
"Jon Stewart's Outrage Forced Washington to Actually Do Something Good | The 9/11 first responders bill passed the Senate Tuesday, 97-2.",The-Autarkh,Politics,2231,all
Millions of Americans Flood Into Mexico for Health Care — the Human Caravan You Haven’t Heard About,darkizzle,Politics,4619,all
Admit it: Trump is unfit to serve,sivribiber,Politics,8584,all
Trump Is Lying. He Did Not Take Coronavirus Seriously for Weeks.,cogit4se,Politics,2436,all
Megathread: White House Says It Will Not Cooperate With House Impeachment Inquiry,PoliticsModeratorBot,Politics,18217,all
"By dropping Michael Flynn’s case, Barr has stripped centuries of credibility from the department of justice",Baarney23,Politics,3140,all
"Special counsel is investigating Trump for possible obstruction of justice, officials say",NSGJoe,Politics,8916,all
House votes to reinstate Obama-era net neutrality rules,powerslave-1,Politics,1926,all
Trump personally met with Russian ambassador during campaign,jlew24asu,Politics,6333,all
Random Mar-a-Lago Guests Were Told More About Plan to Kill Soleimani Than Congress: Report,Molire,Politics,2296,all
Trump 2020 campaign used a shell company to pay ad buyers at the center of alleged illegal coordination scheme with NRA,Bobsind,Politics,2632,all
Files Appear to Show Gerrymandering Specialist Unconstitutionally Used Race Data to Draw Voting Maps,Fr1sk3r,Politics,1677,all
"One Death Is a Tragedy. 60,000 Deaths Are a Great Success. Most presidents try to console the nation in moments of grief, but Donald Trump is taking a victory lap.",ericbernatchez,Politics,3992,all
Trump Told Russians That Firing ‘Nut Job’ Comey Eased Pressure From Investigation,71tsiser,Politics,9748,all
"'Unfit, unwell, unacceptable': Anti-Trump Republicans turn president's disastrous disinfectant cure comments into scathing attack ad",neighborinotwink,Politics,3033,all
President Trump repeats his call for investigation into 'Saturday Night Live' because TV show makes fun of him,MastersOfTheUnibrow,Politics,3313,all
Adam Schiff Says Donald Trump's Power Isn't Absolute 'But His Incompetence Is' After Coronavirus Briefing,hildebrand_rarity,Politics,2088,all
Trump Says He Won't Approve Covid-19 Package Without Tax Cut That Offers Zero Relief for 30 Million Newly Unemployed,Mamacrass,Politics,4500,all
Megathread: The US House of Representatives approves measure to restrain President Donald Trump’s actions on Iran,PoliticsModeratorBot,Politics,7569,all
McConnell admits he was wrong to say Obama administration failed to leave pandemic playbook,habichuelacondulce,Politics,1693,all
Trump Urged To Resign Before Impeachment Vote: 'It Would Be The Most Shared Tweet Of All Time',BlackDog_II,Politics,5199,all
The US Navy canceled a routine Black Sea patrol after Trump complained that it was hostile to Russia,Pomp_N_Circumstance,Politics,3026,all
Are We Pretending Donald Trump Wasn’t Secretly Rushed to the Hospital?,Captainstinkytits,Politics,7725,all
"Comey willing to testify, but only in public: report",Militant_kakapo,Politics,4086,all
"In Leaked Audio, Brian Kemp Expresses Concern Over Georgians Exercising Their Right to Vote",swinglinefan,Politics,3803,all
Megathread: Attorney General Jefferson Sessions Resigns at Request of President Donald Trump,PoliticsModeratorBot,Politics,32318,all
Trump Mulls Letting Turkey Kill U.S. Resident to Help Saudis Get Away With Killing U.S. Resident,TrumpSharted,Politics,2520,all
Florida shooting survivor: We should call AR-15s ‘Marco Rubio’ because they’re both easy to buy,dandmcd,Politics,3855,all
The Secret Service signed an 'emergency order' this week — for 30 golf carts,TheWeekMag,Politics,2443,all
Grinning Trump gives thumbs-up with baby whose parents were shot dead in El Paso atrocity,ginger_bredman,Politics,6791,all
Elizabeth Warren’s campaign sent dinner to Bernie Sanders staffers after his heart procedure,boognish908,Politics,3473,all
Donald Trump Played Central Role in Hush Payoffs to Stormy Daniels and Karen McDougal,WoRanger14,Politics,4457,all
Reddit users demand ban for notorious pro-Trump community,mixplate,Politics,8205,all
Tribes Were Supposed To Get $8 Billion In COVID-19 Aid. They’ve Gotten $0.,cram213,Politics,2208,all
Trump disbanded NSC pandemic unit that experts had praised,,Politics,1968,all
Mitch McConnell Challenger Amy Mcgrath Releases Blistering Ad in Kentucky: He 'Left Our Coal Miners Behind',wenchette,Politics,1545,all
"Mattis orders Pentagon to allow transgender troops to continue serving, pending study",JASJMS,Politics,3285,all
"Taxpayers paid for food, a harpist, and goody bags for Pompeo's frequent 500-guest formal dinners",skl692,Politics,2004,all
"Mueller: ‘If We Had Confidence That the President Did Not Commit a Crime, We Would Have Said So’",thesesforty-three,Politics,6756,all
White House Memo Admits There Was No “Imminent Threat” Before Soleimani Assassination,billthomson,Politics,2795,all
Trump officials are bending over backwards to say he didn't threaten to commit a war crime after he repeatedly threatened to commit a war crime,leocohen99,Politics,2548,all
Trump: I'm '100%' willing to testify under oath,Somali_Pir8,Politics,8304,all
US Senate healthcare repeal bill fails,saucytryhard,Politics,8207,all
James Comey asked to testify before the Senate as a private citizen,flibbityandflobbity,Politics,4567,all
The Secret Correspondence Between Donald Trump Jr. and Wikileaks,ineedmoney1604,Politics,7938,all
California Senate passes bill that would keep Trump off 2020 ballot unless he releases tax returns,yam12,Politics,5388,all
"'This Is Not a Drill': Demonstrations in Over 1,000 US Cities Against Trump's Assault on Democracy, Rule of Law",chris-jjj,Politics,3767,all
"FBI to continue Trump-Russia probe but will not update White House, Acting FBI Director announces",AbduIIa,Politics,4821,all
Document reveals Trump administration planned on separating migrant families soon after inauguration,stupidstupidreddit,Politics,4650,all
Calls for AG Barr’s Impeachment Intensify After ‘Lunatic Authoritarian’ Federalist Society Speech,WalmartVirgin,Politics,3121,all
"More Americans support Trump's impeachment than oppose it for first time, poll finds",saucytryhard,Politics,4114,all
Megathread: Federal Court overturns President Trump's executive order regarding immigration,PoliticsModeratorBot,Politics,17636,all
Trump says he doesn't care about predicted US national debt explosion because ‘I won't be here’,madazzahatter,Politics,3575,all
President Donald Trump Fires Impeachment Witnesses,PoliticsModeratorBot,Politics,10643,all
"Ocasio-Cortez: Paul Ryan got called a 'genius' when he was elected at 28, I get accused of being 'a fraud'",Perfect_Gas,Politics,3458,all
"McConnell Faces Calls to Recuse Himself From Impeachment Trial After Saying 'No Chance' Trump Will Be Removed; ""No court in the country would allow a member of the jury to also serve as the accused's defense attorney.""",Thinkingonsleeping,Politics,2384,all
'I am back': Sanders tops Warren with massive New York City rally,asiasbutterfly,Politics,4171,all
"‘As I was being eaten, I was thinking about my insurance’: Woman who lost face in bear attack on why she’s voting for Bernie Sanders",MemweatherDangle,Politics,3678,all
NC-9 scandal: More than a thousand absentee ballots possibly destroyed,cogit4se,Politics,1533,all
House backs release of Trump whistleblower complaint 421-0,2big_2fail,Politics,3298,all
Trump threatens to withhold Michigan funding after state's decision to mail absentee ballot applications,Smitka313,Politics,4382,all
Warren introduces bill to redirect wall money to coronavirus,ismuq,Politics,3536,all
"‘I think Amazon should start paying their taxes,’ Joe Biden says",swingadmin,Politics,5285,all
Donald Trump back on the golf course for the 14th time in 10 weeks,Taswelltoo,Politics,4597,all
"Trump sits, talks through song lowering the flag at military base amid NFL anthem controversy",DJTHatesPuertoRicans,Politics,4534,all
"Sanders: Biden 'is a decent guy, he's just wrong on the issues'",occationalRedditor,Politics,5710,all
Danny Devito endorses Bernie Sanders: 'He is the man to beat Trump',Bernie-Standards,Politics,1774,all
"With Postal Service on 'Verge of Collapse' and 630,000 Jobs at Risk, Trump Slammed for Refusing to Act. ""We've pleaded with the White House to help. Donald Trump personally directed his staff not to do so.""",DaFunkJunkie,Politics,3467,all
Wikipedia Added US Border 'Detention Centers' to Its List of Concentration Camps,AldoTheeApache,Politics,5273,all
"If the Postal Service Dies, So Does Democracy — Republicans are now trying to kill the post office and mail-in voting.",chris-jjj,Politics,3455,all
Trump and Fox News Are Suddenly Silent on Their “Miracle” Drug Hydroxychloroquine,StevenSanders90210,Politics,3711,all
Speaker Nancy Pelosi says Trump can't be considered acquitted if Senate doesn't call witnesses in impeachment trial,Morihando,Politics,4618,all
All living former presidents refute Trump's claim they privately voiced support for border wall,Jons312,Politics,3171,all
CNN: Trump signed letter of intent to build Trump Tower in Moscow,dscreations,Politics,3839,all
Alexandria Ocasio-Cortez Just Expertly Laid a Trap to Get Donald Trump’s Tax Returns; her line of questioning during Michael Cohen’s hearing was praised for its clarity and deftness.,bbukbots,Politics,5763,all
Tulsi Gabbard missed 85% of House votes this fall. Hawaii's ex-governor wants her to resign,wizardofthefuture,Politics,5158,all
#CNNisTrash trending after Dem. debate for biased questions against Bernie Sanders,Dashiell_Hammett,Politics,6178,all
Howard Stern says Trump's border wall won't solve immigration problems: It's just something 'morons can get behind',chris-jjj,Politics,4382,all
Democratic presidential hopeful Bernie Sanders to be endorsed by Alexandria Ocasio-Cortez,nnnarbz,Politics,4601,all
Republicans just introduced a bill to remove Mueller from the Trump-Russia investigation,animositisomina35,Politics,5639,all
"Mueller testimony: Trump ordered former White House counsel Don McGahn to lie, special counsel confirms",Antinatalista,Politics,3625,all
Pompeo Openly Admits He Asked Trump to Fire Inspector General Because He Wasn't Doing What 'We Had Tried To Get Him To',Innocul8,Politics,2138,all
"Trump Just Blurted Out, Unprompted, That He Installed His Pet Attorney General Over the Russia Probe",JAlbert653,Politics,4227,all
"Warren reminds Trump he offered $1 million if she proved her Native American heritage, calls on him to donate it",BEARlovesCOOKIE,Politics,6345,all
"After becoming president, Trump sold millions in real estate in secret deals",UWCG,Politics,2902,all
Democrat Andy Beshear just unseated Kentucky’s Trump-loving governor Matt Bevin,Phylamedeian,Politics,2802,all
Petition Demanding Donald Trump Release His Tax Returns Breaks White House Record,YourFavYellowMan,Politics,2947,all
Megathread: Report States Trump Repeatedly Pressed Ukraine President to Investigate Biden’s Son,PoliticsModeratorBot,Politics,12864,all
Trump doesn't think he's 'ever even heard of a Category 5' hurricane. Four such storms hit the US since he took office,ThePrestigeVIII,Politics,2739,all
Trump calls impeachment probe 'a coup' designed to strip citizens of rights in furious Twitter thread,nnnarbz,Politics,6928,all
Donald Trump Jr. reportedly hiding in Canada from media as Mueller indictment looms,danielthetemp,Politics,4219,all
"America is falling out of love with billionaires, and it’s about time",TJ_SP,Politics,5045,all
"The House Impeached Trump, and the Stock Market Did Not Crash Like He Said It Would",JLBesq1981,Politics,2023,all
California bill would make Election Day a state holiday,nosotros_road_sodium,Politics,2295,all
"Trump Lawyer Arranged $130,000 Payment For Adult-Film Star’s Silence",JAndiz,Politics,5879,all
McConnell blocks House bills to reopen government,emitremmus27,Politics,5935,all
'I want to quit': Fox News employees say their network's Russia coverage was 'an embarrassment',scuba_steve757,Politics,5516,all
Trump urges Attorney General Sessions to stop Mueller probe 'right now,Barack_Odrama90,Politics,6696,all
Bernie Sanders: Coronavirus Impact Makes Need for Medicare for All Clear,wbedwards,Politics,2772,all
"Trump Campaign Coordinator And 'Family Values' Republican Pleads Guilty To Child Sex Trafficking, Faces Life in Prison",wonderingsocrates,Politics,2778,all
Trump Fires Inspector General Ahead of Damning Whistleblower Complaint About Bogus Coronavirus Cures,ohnoh18,Politics,2035,all
McConnell blocks bill to reopen most of government,emitremmus27,Politics,3792,all
Calls Grow for Sen. Burr to Resign After He Sold $1.7 Million in Stocks & Downplayed COVID-19 Risks,IntnsRed,Politics,1045,all
It’s time — high time — to take Fox News’s destructive role in America seriously,lobsterbash,Politics,5198,all
Melania Trump booed at youth opioid summit in Baltimore,nclobo,Politics,4273,all
"Say it loud, say it clear: Donald Trump needs to resign over his handling of the coronavirus",greenblue98,Politics,3303,all
Audience bursts out laughing after GOP Senate candidate says Trump is ‘standing up’ to Russia,ourlifeintoronto,Politics,2014,all
"Megathread: In rare statement, Mueller's office disputes nature of Buzzfeed report on Cohen's Trump Tower testimony",PoliticsModeratorBot,Politics,21504,all
